{"run":239,"commit":"bc45b10","metric":0.3411059367876891,"metrics":{},"status":"discard","description":"bench(browser): continue browser workload bisection on the current kept 0.32.1 winner by lowering the host browser transfer to 20 MiB. This browser run completes (about 119 Mb/s up, 308 Mb/s down, 19 ms latency), while the primary direct benchmark reruns at 0.3411 and stays below the kept 0.3487. The browser failure threshold for the kept mtu=1500 config is therefore now narrowed to somewhere between 20 MiB and 24 MiB per direction on this host path.","timestamp":1773691596214,"segment":5}
{"run":240,"commit":"bc45b10","metric":0,"metrics":{},"status":"crash","description":"bench(browser): tighten the browser workload bisection on the current kept 0.32.1 winner by testing 22 MiB per direction. The host browser run still times out while the primary direct benchmark stays healthy at 0.3431, so the browser failure threshold for the kept mtu=1500 config is now narrowed further to somewhere between 20 MiB and 22 MiB on this machine.","timestamp":1773691759756,"segment":5}
{"run":241,"commit":"bc45b10","metric":0,"metrics":{},"status":"crash","description":"perf(webrtc): test whether the kept mtu=1500 winner can gain browser robustness by shrinking MAX_BUFFERED_AMOUNT from 2 MiB to 1.5 MiB while keeping enableIceTcp=false, enableIceUdpMux=false, sendBufferSize=3 MiB, recvBufferSize=2 MiB, congestionControlModule=1, and a 75% resume threshold. The primary direct benchmark stays competitive at 0.3456, but the 32 MiB host browser run still times out, so simply lowering the shared buffered cap does not fix the browser-path instability.","timestamp":1773691915352,"segment":5}
{"run":242,"commit":"bc45b10","metric":0,"metrics":{},"status":"crash","description":"perf(webrtc): test whether the kept mtu=1500 winner can gain browser robustness by shrinking the SCTP send queue from 3 MiB to 2.5 MiB while keeping enableIceTcp=false, enableIceUdpMux=false, recvBufferSize=2 MiB, MAX_BUFFERED_AMOUNT=2 MiB, congestionControlModule=1, and a 75% resume threshold. The 32 MiB host browser run still times out and the primary ratio also slips to 0.3376, so this is not a useful compromise.","timestamp":1773692091202,"segment":5}
{"run":243,"commit":"bc45b10","metric":0.3204903420204836,"metrics":{},"status":"discard","description":"perf(webrtc): validate whether the more browser-tolerant mtu=1400 + MAX_BUFFERED_AMOUNT=3 MiB variant scales beyond the earlier 32 MiB smoke check by running a 64 MiB host browser transfer before the primary benchmark. The browser run still completes at 64 MiB (about 198 Mb/s up, 302 Mb/s down, 8 ms latency), confirming this conservative no-mux regime is materially more browser-robust than the kept mtu=1500 winner, but the primary direct benchmark remains far behind at 0.3205.","timestamp":1773692316833,"segment":5}
{"run":244,"commit":"bc45b10","metric":0,"metrics":{},"status":"crash","description":"perf(webrtc): test whether the browser-robust mtu=1400 + MAX_BUFFERED_AMOUNT=3 MiB regime can recover some primary throughput with only a slight send-queue increase by raising sendBufferSize from 3 MiB to 3.25 MiB while keeping recvBufferSize=2 MiB, enableIceTcp=false, enableIceUdpMux=false, congestionControlModule=1, and a 75% resume threshold. Even this small send-buffer increase makes the 32 MiB host browser run time out and only reaches 0.3221 in the primary benchmark, so the browser-tolerant 1400/3 MiB buffered regime is very sensitive to larger send queues.","timestamp":1773692490889,"segment":5}
{"run":245,"commit":"bc45b10","metric":0,"metrics":{},"status":"crash","description":"perf(webrtc): test whether the browser-robust mtu=1400 + MAX_BUFFERED_AMOUNT=3 MiB regime can recover primary throughput by reducing recvBufferSize from 2 MiB to 1.5 MiB while keeping sendBufferSize=3 MiB, enableIceTcp=false, enableIceUdpMux=false, congestionControlModule=1, and a 75% resume threshold. The 32 MiB host browser run times out again and the primary ratio is only 0.3230, so this browser-tolerant regime is also sensitive to shrinking the receive buffer below 2 MiB.","timestamp":1773692669869,"segment":5}
{"run":246,"commit":"bc45b10","metric":0,"metrics":{},"status":"crash","description":"perf(webrtc): interpolate between the plain browser-viable mtu=1400 setup and the more buffered mtu=1400 + MAX_BUFFERED_AMOUNT=3 MiB variant by setting MAX_BUFFERED_AMOUNT to 2.5 MiB while keeping enableIceTcp=false, enableIceUdpMux=false, sendBufferSize=3 MiB, recvBufferSize=2 MiB, congestionControlModule=1, and a 75% resume threshold. The primary direct benchmark improves to 0.3267, slightly above the 3 MiB-buffered variant, but the 32 MiB host browser run times out, so this mid-buffer point is already outside the browser-tolerant region.","timestamp":1773692954055,"segment":5}
{"run":247,"commit":"bc45b10","metric":0,"metrics":{},"status":"crash","description":"bench(browser): check whether the kept 0.32.1 mtu=1500 winner merely needs a longer browser-side timeout by rerunning the 32 MiB host browser workload with MEASURE_TIMEOUT_MS raised from 30s to 120s before the primary benchmark. The browser run still fails with `TimeoutError: signal timed out` even under the much longer timeout, while the primary direct benchmark remains strong at 0.3433, so the browser issue is not just an overly tight smoke-test timeout.","timestamp":1773693136981,"segment":5}
{"run":248,"commit":"bc45b10","metric":0,"metrics":{},"status":"crash","description":"diag(browser): instrument the browser benchmark client to include recent perf outputs on timeout, then rerun the kept 0.32.1 mtu=1500 winner on the 32 MiB host browser workload before the primary benchmark. The browser still fails, but now the error reports `recentOutputs=[]`, meaning the browser path times out before even the first intermediary perf sample is emitted. So this is not just a slow tail after partial transfer — the kept config appears to stall before meaningful upload/download progress on the host browser path, even while the primary direct benchmark reruns strongly at 0.3471.","timestamp":1773693337711,"segment":5}
{"run":249,"commit":"bc45b10","metric":0.3400885010043381,"metrics":{},"status":"discard","description":"perf(webrtc): target the browser→node upload stall in the kept 0.32.1 mtu=1500 winner by making the shared send pacing more conservative — lower bufferedAmountLowThreshold from 75% to 66% of MAX_BUFFERED_AMOUNT while keeping enableIceTcp=false, enableIceUdpMux=false, mtu=1500, sendBufferSize=3 MiB, recvBufferSize=2 MiB, MAX_BUFFERED_AMOUNT=2 MiB, and congestionControlModule=1. This is the first simple pacing change that fixes the 32 MiB host browser run on the kept MTU path (about 162 Mb/s up, 297 Mb/s down, 16 ms latency) while preserving a still-strong primary ratio of 0.3401, but it does not beat the 0.3487 best.","timestamp":1773693641765,"segment":5}
{"run":250,"commit":"bc45b10","metric":0.34641931539791115,"metrics":{},"status":"discard","description":"perf(webrtc): continue dialing back the shared send pacing on the kept 0.32.1 mtu=1500 winner by lowering bufferedAmountLowThreshold from 75% to 70% of MAX_BUFFERED_AMOUNT while keeping enableIceTcp=false, enableIceUdpMux=false, mtu=1500, sendBufferSize=3 MiB, recvBufferSize=2 MiB, MAX_BUFFERED_AMOUNT=2 MiB, and congestionControlModule=1. The 32 MiB host browser run now completes cleanly (about 176 Mb/s up, 307 Mb/s down, 14 ms latency) and the primary ratio stays very strong at 0.3464, but it still trails the 0.3487 best.","timestamp":1773693831603,"segment":5}
{"run":251,"commit":"bc45b10","metric":0,"metrics":{},"status":"crash","description":"perf(webrtc): tighten the pacing threshold search on the kept 0.32.1 mtu=1500 winner by lowering bufferedAmountLowThreshold from 75% only to 72% of MAX_BUFFERED_AMOUNT while keeping enableIceTcp=false, enableIceUdpMux=false, mtu=1500, sendBufferSize=3 MiB, recvBufferSize=2 MiB, MAX_BUFFERED_AMOUNT=2 MiB, and congestionControlModule=1. The 32 MiB host browser run times out again even though the primary ratio stays strong at 0.3432, so the browser-safe threshold boundary lies somewhere below 72% and above the passing 70% run.","timestamp":1773693997135,"segment":5}
{"run":252,"commit":"bc45b10","metric":0.3451367981748643,"metrics":{},"status":"discard","description":"perf(webrtc): tighten the shared pacing search on the kept 0.32.1 mtu=1500 winner by lowering bufferedAmountLowThreshold to 71% of MAX_BUFFERED_AMOUNT while keeping enableIceTcp=false, enableIceUdpMux=false, mtu=1500, sendBufferSize=3 MiB, recvBufferSize=2 MiB, MAX_BUFFERED_AMOUNT=2 MiB, and congestionControlModule=1. The 32 MiB host browser run still completes (about 163 Mb/s up, 266 Mb/s down, 28 ms latency) and the primary ratio stays very strong at 0.3451, but it still trails the 0.3487 best.","timestamp":1773694169880,"segment":5}
{"run":253,"commit":"bc45b10","metric":0,"metrics":{},"status":"crash","description":"perf(webrtc): split the browser-safe pacing boundary on the kept 0.32.1 mtu=1500 winner by lowering bufferedAmountLowThreshold to 71.5% of MAX_BUFFERED_AMOUNT while keeping enableIceTcp=false, enableIceUdpMux=false, mtu=1500, sendBufferSize=3 MiB, recvBufferSize=2 MiB, MAX_BUFFERED_AMOUNT=2 MiB, and congestionControlModule=1. The 32 MiB host browser run times out again while the primary ratio remains strong at 0.3452, so the browser-safe threshold window is very narrow: 71% passes, 71.5% fails, and 72% fails.","timestamp":1773694335889,"segment":5}
{"run":254,"commit":"bc45b10","metric":0.3495059584834116,"metrics":{},"status":"discard","description":"perf(webrtc): continue the browser-safe pacing sweep by lowering bufferedAmountLowThreshold to 69% of MAX_BUFFERED_AMOUNT while keeping enableIceTcp=false, enableIceUdpMux=false, mtu=1500, sendBufferSize=3 MiB, recvBufferSize=2 MiB, MAX_BUFFERED_AMOUNT=2 MiB, and congestionControlModule=1. This actually nudges the primary ratio up to 0.3495, slightly above the kept 0.3487, but the 32 MiB host browser run times out again. Because the user goal is browser streaming performance, that browser regression is catastrophic enough to discard this otherwise-improving node-local benchmark result as likely overfitting.","timestamp":1773694511020,"segment":5}
{"run":255,"commit":"bc45b10","metric":0.34547695994736427,"metrics":{},"status":"discard","description":"perf(webrtc): refine the shared pacing search on the kept 0.32.1 mtu=1500 winner by lowering bufferedAmountLowThreshold to 70.5% of MAX_BUFFERED_AMOUNT while keeping enableIceTcp=false, enableIceUdpMux=false, mtu=1500, sendBufferSize=3 MiB, recvBufferSize=2 MiB, MAX_BUFFERED_AMOUNT=2 MiB, and congestionControlModule=1. The 32 MiB host browser run still completes and the primary ratio stays healthy at 0.3455, but this still trails both the kept 0.3487 best and the stronger passing 70% run.","timestamp":1773694689961,"segment":5}
{"run":256,"commit":"bc45b10","metric":0.34786847432318874,"metrics":{},"status":"discard","description":"bench(webrtc): rerun the promising 69% bufferedAmountLowThreshold variant on the kept 0.32.1 mtu=1500 config after its first browser attempt flaked. With enableIceTcp=false, enableIceUdpMux=false, mtu=1500, sendBufferSize=3 MiB, recvBufferSize=2 MiB, MAX_BUFFERED_AMOUNT=2 MiB, and congestionControlModule=1, the 32 MiB host browser run now completes (about 152 Mb/s up, 277 Mb/s down, 10 ms latency) and the primary ratio reruns at 0.3479. That is slightly below the kept 0.3487 best, so it is still a discard, but it shows the browser-safe pacing window likely extends at least down to 69% and that the earlier 69% browser failure was probably noise rather than a hard boundary.","timestamp":1773694871637,"segment":5}
{"run":257,"commit":"bc45b10","metric":0.34554080451999275,"metrics":{},"status":"discard","description":"bench(webrtc): rerun the 69% bufferedAmountLowThreshold browser-safe pacing variant again to gauge whether the near-best 0.3479 result was stable. With enableIceTcp=false, enableIceUdpMux=false, mtu=1500, sendBufferSize=3 MiB, recvBufferSize=2 MiB, MAX_BUFFERED_AMOUNT=2 MiB, and congestionControlModule=1, the 32 MiB host browser run still completes, but the primary ratio drops back to 0.3455. So the 69% variant looks viable for browser sanity, yet still not reliably ahead of the kept 0.3487 node-local best.","timestamp":1773695045620,"segment":5}
{"run":258,"commit":"bc45b10","metric":0,"metrics":{},"status":"crash","description":"bench(browser): check whether the promising 70% bufferedAmountLowThreshold compromise on the kept 0.32.1 mtu=1500 path scales beyond the 32 MiB browser workload by rerunning it at 64 MiB before the primary benchmark. The 64 MiB host browser run still times out while the primary direct benchmark remains healthy at 0.3417, so the lower-threshold pacing fix clearly extends browser tolerance beyond the original 20 MiB limit but still does not deliver the same robustness as the slower mtu=1400 fallback.","timestamp":1773695262595,"segment":5}
{"run":259,"commit":"bc45b10","metric":0,"metrics":{},"status":"crash","description":"bench(browser): test whether the more conservative 69% bufferedAmountLowThreshold variant on the kept 0.32.1 mtu=1500 path can reach the browser robustness of the slower mtu=1400 fallback by rerunning it at 64 MiB before the primary benchmark. The 64 MiB host browser run still times out, and the primary ratio also falls to 0.3417, so lowering the resume threshold from 70% to 69% does not materially extend browser robustness beyond the 32 MiB workload.","timestamp":1773695522581,"segment":5}
{"run":260,"commit":"bc45b10","metric":0.33506029266644777,"metrics":{},"status":"discard","description":"bench(browser): rerun the promising 70% bufferedAmountLowThreshold compromise on the kept 0.32.1 mtu=1500 path at a 64 MiB browser workload after adding browser-side recent-output diagnostics. This time the 64 MiB host browser run completes (about 212 Mb/s up, 300 Mb/s down, 9 ms latency), so the earlier 64 MiB timeout was not a hard boundary; however the primary direct benchmark falls to 0.3351 on this run, well below the kept 0.3487 best.","timestamp":1773695729377,"segment":5}
{"run":261,"commit":"bc45b10","metric":0,"metrics":{},"status":"crash","description":"perf(webrtc): refine the lower-threshold pacing search on the kept 0.32.1 mtu=1500 path by setting bufferedAmountLowThreshold to 69.5% of MAX_BUFFERED_AMOUNT while keeping enableIceTcp=false, enableIceUdpMux=false, sendBufferSize=3 MiB, recvBufferSize=2 MiB, MAX_BUFFERED_AMOUNT=2 MiB, congestionControlModule=1, and the browser-side diagnostics active. The 32 MiB host browser run times out again and the primary ratio drops to 0.3387, so 69.5% does not behave like a clean sweet spot between the noisy 69% and the steadier 70% setting.","timestamp":1773695907577,"segment":5}
{"run":262,"commit":"bc45b10","metric":0,"metrics":{},"status":"crash","description":"perf(webrtc): see whether the best browser-passing pacing compromise can recover some primary throughput with a very small send-queue increase by setting bufferedAmountLowThreshold to 70% and raising sendBufferSize from 3 MiB to 3.125 MiB while keeping enableIceTcp=false, enableIceUdpMux=false, mtu=1500, recvBufferSize=2 MiB, MAX_BUFFERED_AMOUNT=2 MiB, and congestionControlModule=1. Even this tiny send-buffer increase makes the 32 MiB host browser run time out again, while the primary ratio only reaches 0.3450, so the browser-safe 70% pacing regime is also sensitive to send queue growth.","timestamp":1773696088565,"segment":5}
{"run":263,"commit":"bc45b10","metric":0,"metrics":{},"status":"crash","description":"perf(webrtc): try to extend the browser robustness of the promising 70% pacing compromise without sacrificing too much primary throughput by shrinking MAX_BUFFERED_AMOUNT from 2 MiB to 1.75 MiB while keeping enableIceTcp=false, enableIceUdpMux=false, mtu=1500, sendBufferSize=3 MiB, recvBufferSize=2 MiB, and congestionControlModule=1. The primary ratio stays strong at 0.3474, but the 64 MiB host browser run still times out, so lowering the buffered cap is not enough to turn the lower-threshold mtu=1500 regime into a browser-robust large-transfer path.","timestamp":1773696257159,"segment":5}
{"run":264,"commit":"bc45b10","metric":0,"metrics":{},"status":"crash","description":"perf(webrtc): see whether the browser-passing 70% pacing compromise can recover some primary throughput with a modest receive-queue increase by raising recvBufferSize from 2 MiB to 2.25 MiB while restoring MAX_BUFFERED_AMOUNT to 2 MiB and keeping enableIceTcp=false, enableIceUdpMux=false, mtu=1500, sendBufferSize=3 MiB, and congestionControlModule=1. The 32 MiB host browser run times out again and the primary ratio slips to 0.3411, so the browser-safe 70% regime is sensitive to recv-buffer growth as well.","timestamp":1773696456708,"segment":5}
{"run":265,"commit":"bc45b10","metric":0.3451789047232589,"metrics":{},"status":"discard","description":"bench(webrtc): rerun the 69% bufferedAmountLowThreshold compromise on the kept 0.32.1 mtu=1500 path once more with the 32 MiB host browser sanity check, to see whether the earlier near-frontier 0.3479 result was reproducible. With enableIceTcp=false, enableIceUdpMux=false, sendBufferSize=3 MiB, recvBufferSize=2 MiB, MAX_BUFFERED_AMOUNT=2 MiB, mtu=1500, and congestionControlModule=1, the browser run still completes but the primary ratio lands at 0.3452, so 69% remains browser-viable at 32 MiB yet still does not reliably beat the kept 0.3487 best.","timestamp":1773696778701,"segment":5}
{"run":266,"commit":"a52027b","metric":0.3515425237265303,"metrics":{},"status":"keep","description":"perf(webrtc): improve the shared send pacing on the node-datachannel 0.32.1 no-mux mtu=1500 winner by lowering bufferedAmountLowThreshold from 75% to 70% of MAX_BUFFERED_AMOUNT while keeping enableIceTcp=false, enableIceUdpMux=false, sendBufferSize=3 MiB, recvBufferSize=2 MiB, MAX_BUFFERED_AMOUNT=2 MiB, and congestionControlModule=1. This run beats the prior 0.3487 best at 0.3515 and the paired 32 MiB host browser sanity check also completes (about 386 Mb/s upload, 390 Mb/s download in the primary benchmark; browser smoke about 32 MiB pass), though larger browser workloads around 64 MiB are still noisy and need more validation.","timestamp":1773696952318,"segment":5}
{"run":267,"commit":"a52027b","metric":0.3457757248411208,"metrics":{},"status":"discard","description":"bench(browser): validate the new 70% bufferedAmountLowThreshold winner against a heavier 64 MiB host browser workload before trusting it too much. The browser run now completes at 64 MiB as well (about 201 Mb/s up, 282 Mb/s down, 7 ms latency), which materially improves confidence that the lower-threshold pacing change helps the real browser path, but the primary benchmark rerun lands lower at 0.3458 and stays below the kept 0.3515 result.","timestamp":1773697124606,"segment":5}
{"run":268,"commit":"a52027b","metric":0,"metrics":{},"status":"crash","description":"bench(browser): push the new 70% bufferedAmountLowThreshold winner to a heavier 128 MiB host browser workload to map how far the improved shared-path robustness extends. The 128 MiB browser run still times out with `TimeoutError: signal timed out` even though the primary direct benchmark remains strong at 0.3460, so the new best is materially better on the browser path than the old 75% version but still not robust all the way to the heavier browser workloads.","timestamp":1773697299938,"segment":5}
{"run":269,"commit":"a52027b","metric":0,"metrics":{},"status":"crash","description":"bench(browser): map the heavier browser robustness boundary for the new 70% bufferedAmountLowThreshold winner by testing a 96 MiB host browser workload before the primary benchmark. The 96 MiB browser run times out while the primary benchmark remains strong at 0.3472, so the current best clearly handles 64 MiB better than the old 75% config but still falls over somewhere between 64 MiB and 96 MiB on this host browser path.","timestamp":1773697536776,"segment":5}
{"run":270,"commit":"a52027b","metric":0,"metrics":{},"status":"crash","description":"perf(webrtc): test whether the new 70% bufferedAmountLowThreshold winner can shed the node-only mtu=1500 override and become more browser-representative by removing the explicit MTU while keeping enableIceTcp=false, enableIceUdpMux=false, sendBufferSize=3 MiB, recvBufferSize=2 MiB, MAX_BUFFERED_AMOUNT=2 MiB, and congestionControlModule=1. The 32 MiB host browser run still times out and the primary ratio collapses to 0.2869, so the new pacing improvement does not remove the configuration's strong dependence on the explicit 1500 MTU path.","timestamp":1773697838747,"segment":5}
{"run":271,"commit":"a52027b","metric":0,"metrics":{},"status":"crash","description":"bench(browser): continue mapping the heavier browser boundary for the new 70% bufferedAmountLowThreshold winner by testing an 80 MiB host browser workload before the primary benchmark. The browser run still times out while the primary benchmark remains near the frontier at 0.3490, so the current best's real browser limit on this host lies somewhere between the passing 64 MiB workload and the failing 80 MiB workload.","timestamp":1773698006142,"segment":5}
{"run":272,"commit":"a52027b","metric":0,"metrics":{},"status":"crash","description":"bench(browser): tighten the heavier browser boundary for the new 70% bufferedAmountLowThreshold winner by testing a 72 MiB host browser workload before the primary benchmark. The browser run still times out while the primary benchmark remains healthy at 0.3431, so the passing 64 MiB browser result does not extend cleanly to 72 MiB on this host path.","timestamp":1773698161153,"segment":5}
