{"run":273,"commit":"a52027b","metric":0.33728607038767744,"metrics":{},"status":"discard","description":"bench(browser): continue mapping the heavier browser boundary for the new 70% bufferedAmountLowThreshold winner by testing a 68 MiB host browser workload before the primary benchmark. The browser run completes at 68 MiB, so the current best's browser tolerance on this host is now bracketed between the passing 68 MiB workload and the failing 72 MiB workload. The primary benchmark rerun lands at 0.3373, well below the kept 0.3515 result.","timestamp":1773698327998,"segment":5}
{"run":274,"commit":"a52027b","metric":0.34446745355829,"metrics":{},"status":"discard","description":"bench(browser): rerun the new 70% bufferedAmountLowThreshold winner at a 72 MiB host browser workload while temporarily re-enabling browser-side recent-output diagnostics. This time the 72 MiB browser run also completes (about 174 Mb/s up, 271 Mb/s down, 5 ms latency), so the heavier browser boundary for the current best shifts upward and is now somewhere between the passing 72 MiB workload and the failing 96 MiB workload on this host. The primary benchmark rerun is solid at 0.3445 but still below the kept 0.3515 result.","timestamp":1773698537485,"segment":5}
{"run":275,"commit":"a52027b","metric":0,"metrics":{},"status":"crash","description":"bench(browser): continue mapping the heavier browser boundary for the new 70% bufferedAmountLowThreshold winner by testing an 84 MiB host browser workload before the primary benchmark. The browser run times out while the primary benchmark remains healthy at 0.3429, so the current best's host-browser robustness is now bracketed more tightly between the passing 72 MiB workload and the failing 84 MiB workload.","timestamp":1773698702348,"segment":5}
{"run":276,"commit":"a52027b","metric":0,"metrics":{},"status":"crash","description":"bench(browser): tighten the heavier browser boundary for the new 70% bufferedAmountLowThreshold winner by testing a 76 MiB host browser workload before the primary benchmark. The browser run still times out while the primary benchmark stays strong at 0.3456, so the passing 72 MiB browser result does not cleanly extend to 76 MiB on this host.","timestamp":1773698856314,"segment":5}
{"run":277,"commit":"a52027b","metric":0,"metrics":{},"status":"crash","description":"bench(browser): continue tightening the heavier browser boundary for the new 70% bufferedAmountLowThreshold winner by testing a 74 MiB host browser workload before the primary benchmark. The browser run times out again while the primary benchmark stays respectable at 0.3382, so the practical browser limit on this host now looks to sit somewhere between the passing 72 MiB workload and the failing 74 MiB workload.","timestamp":1773699011115,"segment":5}
{"run":278,"commit":"a52027b","metric":0,"metrics":{},"status":"crash","description":"bench(browser): narrow the heavier browser boundary for the new 70% bufferedAmountLowThreshold winner further by testing a 73 MiB host browser workload before the primary benchmark. The browser run still times out while the primary benchmark stays near the frontier at 0.3468, so the host-browser robustness of the current best appears to sit between the passing 72 MiB workload and the failing 73 MiB workload on this machine.","timestamp":1773699167141,"segment":5}
{"run":279,"commit":"a52027b","metric":0,"metrics":{},"status":"crash","description":"bench(browser): rerun the previously passing 72 MiB host browser workload on the new 70% bufferedAmountLowThreshold winner to gauge stability. This rerun times out while the primary benchmark remains strong at 0.3440, so the current best's heavier browser robustness around the low-70-MiB region is itself noisy rather than a clean hard cutoff.","timestamp":1773699329860,"segment":5}
{"run":280,"commit":"a52027b","metric":0.3459922118256237,"metrics":{},"status":"discard","description":"bench(browser): rerun the previously failing 73 MiB host browser workload on the new 70% bufferedAmountLowThreshold winner while temporarily re-enabling browser-side recent-output diagnostics. This time the 73 MiB browser run completes as well (about 218 Mb/s up, 321 Mb/s down, 9 ms latency), which confirms the low-70-MiB boundary is genuinely noisy rather than fixed. The primary benchmark rerun stays healthy at 0.3460 but remains below the kept 0.3515 result.","timestamp":1773699589769,"segment":5}
{"run":281,"commit":"a52027b","metric":0.35079527902479757,"metrics":{},"status":"discard","description":"bench(browser): rerun the previously failing 84 MiB host browser workload on the new 70% bufferedAmountLowThreshold winner while temporarily re-enabling browser-side recent-output diagnostics. This time the 84 MiB browser run also completes (about 198 Mb/s up, 286 Mb/s down, 9 ms latency), reinforcing that the heavier browser boundary for the current best is noisy rather than fixed. The primary benchmark rerun stays excellent at 0.3508 but still trails the kept 0.3515 result.","timestamp":1773699892690,"segment":5}
{"run":282,"commit":"a52027b","metric":0,"metrics":{},"status":"crash","description":"diag(browser): push the new 70% bufferedAmountLowThreshold winner back to the previously failing 96 MiB host browser workload while recent-output diagnostics are enabled. The browser still fails, and the diagnostic again reports `recentOutputs=[]`, meaning the browser→node upload leg is stalling before even the first intermediary perf sample at this heavier workload. The primary benchmark rerun drops to 0.3382, so this does not look like a simple timeout-margin issue.","timestamp":1773700056037,"segment":5}
{"run":283,"commit":"a52027b","metric":0,"metrics":{},"status":"crash","description":"diag(browser): test whether the slightly more conservative 71% bufferedAmountLowThreshold variant can push the new 0.32.1 mtu=1500 winner through the failing 96 MiB host browser workload. The browser still fails, and diagnostics again report `recentOutputs=[]`, so the browser→node upload leg is still stalling before the first perf sample at 96 MiB. The primary benchmark remains solid at 0.3446 but this does not improve the heavier browser boundary.","timestamp":1773700234843,"segment":5}
{"run":284,"commit":"a52027b","metric":0,"metrics":{},"status":"crash","description":"bench(browser): use the older browser-robust fallback as a control at heavier workload by switching to the slower mtu=1400 + MAX_BUFFERED_AMOUNT=3 MiB regime (with the original 75% resume threshold) and testing a 96 MiB host browser transfer before the primary benchmark. That control also times out at 96 MiB, while the primary benchmark stays far below the kept best at 0.3229. So even the browser-tolerant fallback is not robust all the way to 96 MiB on this host, and the current best's heavier-browser failures are not unique to the mtu=1500 path.","timestamp":1773700423059,"segment":5}
{"run":285,"commit":"a52027b","metric":0,"metrics":{},"status":"crash","description":"bench(browser): continue using the slower mtu=1400 + MAX_BUFFERED_AMOUNT=3 MiB fallback as a robustness control by testing an 84 MiB host browser transfer before the primary benchmark. That control also times out at 84 MiB while the primary benchmark remains far below the kept best at 0.3233. So the older browser-tolerant fallback is not materially more robust than the new best once the host browser workload moves into the mid-80-MiB range.","timestamp":1773700594671,"segment":5}
{"run":286,"commit":"a52027b","metric":0,"metrics":{},"status":"crash","description":"perf(webrtc): test whether the new 70% bufferedAmountLowThreshold winner can gain heavier-browser robustness with a slightly smaller SCTP send queue by lowering sendBufferSize from 3 MiB to 2.75 MiB while keeping enableIceTcp=false, enableIceUdpMux=false, mtu=1500, recvBufferSize=2 MiB, MAX_BUFFERED_AMOUNT=2 MiB, and congestionControlModule=1. The 96 MiB host browser run still times out and the primary ratio slips to 0.3404, so modestly shrinking the send queue does not push the current best through the heavier browser stall.","timestamp":1773700942171,"segment":5}
{"run":287,"commit":"a52027b","metric":0,"metrics":{},"status":"crash","description":"perf(webrtc): test whether much more conservative shared pacing can push the current 0.32.1 mtu=1500 winner through the failing 96 MiB browser workload by lowering bufferedAmountLowThreshold from the kept 70% all the way to 66% of MAX_BUFFERED_AMOUNT while keeping enableIceTcp=false, enableIceUdpMux=false, sendBufferSize=3 MiB, recvBufferSize=2 MiB, MAX_BUFFERED_AMOUNT=2 MiB, and congestionControlModule=1. The 96 MiB host browser run still times out and the primary ratio is only 0.3443, so further lowering the refill threshold does not eliminate the heavier browser stall.","timestamp":1773701103599,"segment":5}
{"run":288,"commit":"a52027b","metric":0,"metrics":{},"status":"crash","description":"diag(browser): rerun the new 70% bufferedAmountLowThreshold winner at the failing 96 MiB host browser workload with recent-output diagnostics restored, to check whether the heavier failure is just noise like 72-84 MiB. It still fails, and diagnostics again report `recentOutputs=[]`, so at 96 MiB the browser→node upload leg is consistently stalling before even the first perf sample on this config. The primary benchmark rerun stays healthy at 0.3422, but the low-70-MiB noise does not extend all the way to 96 MiB.","timestamp":1773701294079,"segment":5}
{"run":289,"commit":"a52027b","metric":0,"metrics":{},"status":"crash","description":"perf(webrtc): retest the shared send path under the new 70% winner by resuming the write queue directly inside RTCDataChannel.onbufferedamountlow instead of only dispatching a drain event, while keeping enableIceTcp=false, enableIceUdpMux=false, mtu=1500, sendBufferSize=3 MiB, recvBufferSize=2 MiB, MAX_BUFFERED_AMOUNT=2 MiB, and congestionControlModule=1. With a 96 MiB host browser precheck this still times out and the primary ratio slips to 0.3428, so the older direct-resume idea remains unhelpful even in the new browser-sensitive pacing regime.","timestamp":1773701501551,"segment":5}
{"run":290,"commit":"a52027b","metric":0,"metrics":{},"status":"crash","description":"bench(browser): rerun the previously flaky 84 MiB host browser workload on the current 70% bufferedAmountLowThreshold winner to gauge whether the earlier passing 84 MiB result was stable. This rerun times out while the primary benchmark falls back to 0.3399, so the mid-80-MiB region remains noisy and cannot yet be treated as reliably supported by the current best.","timestamp":1773701694558,"segment":5}
{"run":291,"commit":"a52027b","metric":0,"metrics":{},"status":"crash","description":"perf(webrtc): probe whether the new 70% bufferedAmountLowThreshold winner can recover a bit more primary throughput with a slightly smaller receive queue by lowering recvBufferSize from 2 MiB to 1.75 MiB while keeping enableIceTcp=false, enableIceUdpMux=false, mtu=1500, sendBufferSize=3 MiB, MAX_BUFFERED_AMOUNT=2 MiB, and congestionControlModule=1. The 32 MiB host browser run times out and the primary ratio slips to 0.3435, so the current best is also sensitive to shrinking the receive queue below 2 MiB.","timestamp":1773701958348,"segment":5}
{"run":292,"commit":"a52027b","metric":0,"metrics":{},"status":"crash","description":"perf(webrtc): test whether the new 70% bufferedAmountLowThreshold winner can recover additional throughput with a slightly larger buffered cap by raising MAX_BUFFERED_AMOUNT from 2 MiB to 2.25 MiB while keeping enableIceTcp=false, enableIceUdpMux=false, mtu=1500, sendBufferSize=3 MiB, recvBufferSize=2 MiB, and congestionControlModule=1. The 32 MiB host browser run times out and the primary ratio slips to 0.3419, so the current best is also sensitive to growing the buffered cap above 2 MiB.","timestamp":1773702128557,"segment":5}
{"run":293,"commit":"a52027b","metric":0,"metrics":{},"status":"crash","description":"diag(browser): rerun the current 70% bufferedAmountLowThreshold winner at the failing 96 MiB host browser workload with recent-output diagnostics enabled from the browser client and extra perf-service context on the node side. This time the failure no longer looks like a pre-transfer upload stall: the browser times out after receiving intermediary download samples of about 32 MiB and 38 MiB in successive seconds, i.e. after roughly 70 MiB of the 96 MiB download phase. So the heavier failure on the current best is now best understood as a late browser-download stall, not simply a failure to begin progress.","timestamp":1773702462817,"segment":5}
{"run":294,"commit":"a52027b","metric":0,"metrics":{},"status":"crash","description":"diag(browser): compare a much more conservative pacing point against the current 70% winner at the failing 96 MiB browser workload by lowering bufferedAmountLowThreshold to 66% with browser-side recent-output diagnostics enabled. Unlike the 70% case, this one times out with `recentOutputs=[]`, meaning the browser path now stalls before even the first intermediary perf sample. So making pacing too conservative appears to regress the heavy browser case back into an early upload/start stall rather than fixing the late download stall seen at 70%.","timestamp":1773702635685,"segment":5}
{"run":295,"commit":"a52027b","metric":0.33890597847173787,"metrics":{},"status":"discard","description":"perf(webrtc): probe the heavy-browser stall with an intermediate pacing point by lowering bufferedAmountLowThreshold from the kept 70% to 68% of MAX_BUFFERED_AMOUNT while keeping enableIceTcp=false, enableIceUdpMux=false, mtu=1500, sendBufferSize=3 MiB, recvBufferSize=2 MiB, MAX_BUFFERED_AMOUNT=2 MiB, and congestionControlModule=1. This is a meaningful browser-robustness improvement: the 96 MiB host browser run now completes (about 199 Mb/s up, 314 Mb/s down, 17 ms latency), whereas 70% and 66% both timed out there. But the primary benchmark falls to 0.3389, so it is still a discard as an optimization target even though it reveals a promising browser-friendlier pacing regime.","timestamp":1773702827318,"segment":5}
{"run":296,"commit":"a52027b","metric":0,"metrics":{},"status":"crash","description":"perf(webrtc): push the browser-friendlier 68% pacing regime to a 128 MiB host browser workload while the browser-side recent-output diagnostics are still enabled. It times out again with `recentOutputs=[]`, so this heavier workload reverts to an early browser→node upload/start stall even though 68% can carry a 96 MiB browser run. The primary benchmark remains decent at 0.3443, but 68% is still not a universal browser fix.","timestamp":1773702993512,"segment":5}
{"run":297,"commit":"a52027b","metric":0,"metrics":{},"status":"crash","description":"perf(webrtc): test whether 69% bufferedAmountLowThreshold can bridge the gap between the kept 70% winner and the browser-friendlier 68% regime at the failing 96 MiB browser workload. It still times out with `recentOutputs=[]`, so 69% behaves like an early browser→node upload/start stall at 96 MiB rather than the late download stall seen at 70%. The primary benchmark remains near the frontier at 0.3480, but this does not improve heavy browser robustness.","timestamp":1773703168408,"segment":5}
{"run":298,"commit":"a52027b","metric":0,"metrics":{},"status":"crash","description":"bench(browser): rerun the previously passing 68% bufferedAmountLowThreshold regime at the 96 MiB browser workload to gauge whether that heavy-browser success was stable. This rerun times out with `recentOutputs=[]`, so the 68% regime is itself noisy at 96 MiB and falls back to the same early browser→node upload/start stall seen at 69% and 66%. The primary benchmark stays respectable at 0.3435, but 68% is not a reliable heavy-browser alternative.","timestamp":1773703334995,"segment":5}
{"run":299,"commit":"a52027b","metric":0,"metrics":{},"status":"crash","description":"diag(native): run the raw node-datachannel/libdatachannel microbenchmark at the current kept queue shape (mtu=1500, sendBufferSize=3 MiB, recvBufferSize=2 MiB, MAX_BUFFERED_AMOUNT=2 MiB, bufferedAmountLowThreshold=70%, 96 MiB transfer) before the primary benchmark. The raw native path aborts with a core dump (exit 134), while the primary benchmark itself still reruns strongly at 0.3434. That is strong evidence the remaining heavy-workload instability is still rooted below libp2p framing, not just in browser harness behavior or threshold tuning.","timestamp":1773703598422,"segment":5}
{"run":300,"commit":"a52027b","metric":0,"metrics":{},"status":"crash","description":"diag(native): compare the browser-friendlier fallback regime against the current best in the raw node-datachannel/libdatachannel microbenchmark by testing mtu=1400 with sendBufferSize=3 MiB, recvBufferSize=2 MiB, MAX_BUFFERED_AMOUNT=3 MiB, a 75% low watermark, and a 96 MiB transfer. The raw native path still aborts with a core dump (exit 134), so the lower-stack instability is not unique to the mtu=1500 winner and remains visible even under the slower browser-friendlier queue shape.","timestamp":1773703754630,"segment":5}
{"run":301,"commit":"a52027b","metric":0,"metrics":{},"status":"crash","description":"diag(native): test the current best queue shape in the raw node-datachannel/libdatachannel microbenchmark with the explicit MTU removed (MTU=0/default) to see whether the lower-stack crash path is tied specifically to the 1500-byte override. The run hung badly enough to hit the outer experiment timeout before the primary benchmark even started, which is consistent with the earlier raw-native picture: default/unset MTU may avoid one crash mode but still leaves the deeper stack unstable or stalled under heavier transfers.","timestamp":1773705584080,"segment":5}
{"run":302,"commit":"a52027b","metric":0.3453790979334166,"metrics":{},"status":"discard","description":"diag(webrtc): run the smaller tracked node-datachannel/polyfill repeated-send repro at the current kept queue shape and 96 MiB (enableIceTcp=false, enableIceUdpMux=false, mtu=1500, sendBufferSize=3 MiB, recvBufferSize=2 MiB, MAX_BUFFERED_AMOUNT=2 MiB, 70% low watermark) before rerunning the primary benchmark. The repro cleanly transfers the full 96 MiB and stays connected, so the heavy browser instability is not reproduced in this smaller node↔node repeated-send surface under the winning no-mux queue shape. That pushes suspicion away from the bare repeated-send/native path alone and toward browser-specific behavior or a higher-layer interaction that only appears in the browser benchmark.","timestamp":1773705953143,"segment":5}
{"run":303,"commit":"a52027b","metric":0.3421663407301505,"metrics":{},"status":"discard","description":"diag(webrtc): run the tracked stream-layer repro (repo WebRTCStream framing/send path over node-datachannel/polyfill) at the current kept queue shape and 96 MiB before rerunning the primary benchmark. It cleanly transfers the full 96 MiB and stays connected, just like the smaller plain repeated-send repro. That means the heavy instability is not reproduced even in the repo's stream/framing layer under node↔node no-mux conditions, which further narrows suspicion toward browser-specific interop behavior or a lower native path that only manifests in the real browser benchmark / raw-native harness.","timestamp":1773706153354,"segment":5}
{"run":304,"commit":"a52027b","metric":0,"metrics":{},"status":"crash","description":"diag(browser): add a temporary mode switch to the browser harness to isolate upload-only versus download-only at heavy workload, then try a 96 MiB upload-only host browser run before the primary benchmark. The temporary harness edit introduced a syntax error in benchmark/webrtc-browser-direct-perf.mjs, so this diagnostic attempt did not run and needs a quick fix before the phase-isolation experiments can continue.","timestamp":1773706369401,"segment":5}
{"run":305,"commit":"a52027b","metric":0,"metrics":{},"status":"crash","description":"diag(browser): continue adding a temporary mode switch to isolate upload-only versus download-only browser phases at 96 MiB. The first fixed syntax issue exposed a second harness bug (`ReferenceError: BROWSER_MODE is not defined`), so this diagnostic still has not run and the temporary browser harness needs one more small fix.","timestamp":1773706564236,"segment":5}
{"run":306,"commit":"a52027b","metric":0.35106257435059174,"metrics":{},"status":"discard","description":"diag(browser): temporarily add a mode switch to the browser harness and run the current kept config in upload-only mode at 96 MiB before rerunning the primary benchmark. The upload-only browser run completes cleanly (about 248 Mb/s, 8 ms latency), which strongly confirms that the current heavy browser failure is not in the browser→node upload leg itself. Combined with the earlier intermediary samples from the full 96 MiB run, that points to the remaining browser instability being in the download phase after a successful upload. The primary benchmark rerun stays very close to the best at 0.3511 but does not exceed the kept 0.3515 result.","timestamp":1773706742469,"segment":5}
{"run":307,"commit":"a52027b","metric":0.3409560468138544,"metrics":{},"status":"discard","description":"diag(browser): use the temporary browser harness mode switch to run the current kept config in download-only mode at 96 MiB before rerunning the primary benchmark. The download-only browser run also completes cleanly (about 281 Mb/s, 7 ms latency). Together with the passing 96 MiB upload-only run, that strongly suggests the full 96 MiB browser failure is not caused by either one-way transfer in isolation, but by their combination on the same reused connection / sequential perf workflow. The primary benchmark rerun lands at 0.3410, below the kept 0.3515 best.","timestamp":1773706924543,"segment":5}
