{"run":14,"commit":"ef81296","metric":0.27506107722888073,"metrics":{},"status":"discard","description":"perf(webrtc): reduce the forced node-datachannel mtu from 1500 to 1400 to see if a slightly safer packet size preserves the win; it still helped versus old defaults but regressed from 0.2909 to 0.2751.","timestamp":1773646601932,"segment":0}
{"run":15,"commit":"ef81296","metric":0.2827420654670043,"metrics":{},"status":"discard","description":"perf(webrtc): try a more protocol-aware node-datachannel mtu of 1472 instead of 1500 for WebRTC-direct; still a big win over defaults, but it trails the 1500 setting at 0.2827 vs 0.2909.","timestamp":1773646742716,"segment":0}
{"run":16,"commit":"ef81296","metric":0.28846735786814914,"metrics":{},"status":"discard","description":"bench: rerun the current best node-datachannel mtu=1500 configuration to gauge stability; result stayed close to the kept 0.2909 run at 0.2885, strengthening confidence that the large mtu win is real despite normal benchmark noise.","timestamp":1773646874113,"segment":0}
{"run":17,"commit":"12693a4","metric":0.29613152407265,"metrics":{},"status":"keep","description":"perf(webrtc): with the node-datachannel mtu forced to 1500, reduce SCTP send buffer back from 9 MiB to 8 MiB while keeping recv at 4 MiB; ratio improved further from 0.2909 to 0.2961 with faster upload throughput.","timestamp":1773647013835,"segment":0}
{"run":18,"commit":"1f5ad54","metric":0.29976358710848994,"metrics":{},"status":"keep","description":"perf(webrtc): with node-datachannel mtu=1500, reduce SCTP send buffer further from 8 MiB to 7 MiB while keeping recv at 4 MiB; ratio improved again from 0.2961 to 0.2998 with faster download throughput.","timestamp":1773647153312,"segment":0}
{"run":19,"commit":"1f5ad54","metric":0.2900921195859826,"metrics":{},"status":"discard","description":"perf(webrtc): with node-datachannel mtu=1500, reduce SCTP send buffer further from 7 MiB to 6 MiB while keeping recv at 4 MiB; ratio regressed from 0.2998 to 0.2901.","timestamp":1773647283973,"segment":0}
{"run":20,"commit":"1f5ad54","metric":0.2980456210842152,"metrics":{},"status":"discard","description":"perf(webrtc): with node-datachannel mtu=1500 and a 7 MiB send buffer, raise the SCTP recv buffer from 4 MiB to 5 MiB; upload improved but overall ratio still trailed the 4 MiB recv best at 0.2980 vs 0.2998.","timestamp":1773647420339,"segment":0}
{"run":21,"commit":"b942f54","metric":0.30985187132105785,"metrics":{},"status":"keep","description":"bench: rerun the current best node-datachannel mtu=1500 + 7 MiB send / 4 MiB recv configuration to gauge stability; instead of regressing it improved further to 0.3099, reinforcing that the mtu-driven native-path win is real and large.","timestamp":1773647546020,"segment":0}
{"run":22,"commit":"b942f54","metric":0.2931549803601946,"metrics":{},"status":"discard","description":"perf(webrtc): with the current mtu=1500 + 7 MiB/4 MiB native tuning, retest a more aggressive 80% bufferedAmount resume threshold; ratio regressed from 0.3099 to 0.2932, so 75% still looks better under the faster native path too.","timestamp":1773647818169,"segment":0}
{"run":23,"commit":"b942f54","metric":0.29881870113533426,"metrics":{},"status":"discard","description":"perf(webrtc): with the current mtu=1500 + 7 MiB/4 MiB native tuning, retest a larger shared-path MAX_BUFFERED_AMOUNT of 7 MiB; throughput stayed strong but ratio regressed from 0.3099 to 0.2988, so 6 MiB still looks better.","timestamp":1773649027693,"segment":0}
{"run":24,"commit":"b942f54","metric":0.2937592802129515,"metrics":{},"status":"discard","description":"perf(webrtc): with mtu=1500 and the current shared-path wins, lower the node SCTP recv buffer from 4 MiB to 3 MiB while keeping the 7 MiB send buffer; ratio regressed from 0.3099 to 0.2938.","timestamp":1773649161578,"segment":0}
{"run":25,"commit":"b942f54","metric":0,"metrics":{},"status":"crash","description":"perf(webrtc): probe underlying native path by enabling ICE UDP mux on both node-datachannel peers instead of just the server; connection setup timed out quickly, so this is unstable for the current direct workload.","timestamp":1773649225355,"segment":0}
{"run":26,"commit":"b942f54","metric":0.29102762815330196,"metrics":{},"status":"discard","description":"perf(webrtc): with mtu=1500 and the current shared-path wins, probe whether the apparent 7 MiB SCTP send-buffer optimum extends to an intermediate 7.5 MiB setting; ratio regressed from 0.3099 to 0.2910, so the extra native queueing does not help.","timestamp":1773650505570,"segment":0}
{"run":27,"commit":"b942f54","metric":0.2880539245796657,"metrics":{},"status":"discard","description":"perf(webrtc): avoid wrapping decoded protobuf payload bytes in a fresh Uint8ArrayList on receive and pass the Uint8Array straight into AbstractMessageStream; this shared-path allocation cut did not help and ratio regressed from 0.3099 to 0.2881.","timestamp":1773650765148,"segment":0}
{"run":28,"commit":"b942f54","metric":0.2943028625665734,"metrics":{},"status":"discard","description":"perf(webrtc): add a shared receive fast path for the common protobuf data-only case (`field 2` bytes payload with no flags) to bypass full Message.decode on hot-path frames; download improved but overall ratio still regressed from 0.3099 to 0.2943.","timestamp":1773651076726,"segment":0}
{"run":29,"commit":"b942f54","metric":0.25970727759597734,"metrics":{},"status":"discard","description":"perf(webrtc): probe a more path-MTU-conservative native setting by lowering the forced node-datachannel PeerConnection mtu from 1500 to 1300; throughput regressed sharply to 0.2597, though separate raw node-datachannel diagnostics suggest the larger-MTU region may still be stability-risky.","timestamp":1773651581203,"segment":0}
{"run":30,"commit":"b942f54","metric":0.300470357629936,"metrics":{},"status":"discard","description":"perf(webrtc): diagnostic-only patch the underlying node-datachannel polyfill so RTCDataChannel prefers the direct onmessage property callback instead of routing every message through an EventTarget listener first; this deeper implementation tweak helped somewhat but still trailed the current best at 0.3005 vs 0.3099.","timestamp":1773651817860,"segment":0}
{"run":31,"commit":"b942f54","metric":0.3042768225190906,"metrics":{},"status":"discard","description":"perf(webrtc): diagnostic-only patch the underlying node-datachannel polyfill to prefer direct property callbacks for open/close/error/bufferedamountlow/message instead of routing those hot events through EventTarget forwarding listeners; this reduced some polyfill overhead but still trailed the current best at 0.3043 vs 0.3099.","timestamp":1773652014504,"segment":0}
{"run":32,"commit":"b942f54","metric":0.28622766073202077,"metrics":{},"status":"discard","description":"perf(webrtc): with mtu=1500, probe whether the native SCTP send-buffer optimum is slightly below 7 MiB by trying 6.75 MiB; throughput regressed badly to 0.2862, so the current 7 MiB setting still looks like the local peak.","timestamp":1773652176930,"segment":0}
{"run":33,"commit":"b942f54","metric":0.2918004427774473,"metrics":{},"status":"discard","description":"perf(webrtc): diagnostic-only patch the underlying node-datachannel polyfill message path to call the onmessage property directly with a minimal `{data}` object instead of always allocating a MessageEvent/EventTarget dispatch on hot-path receives; this deeper patch regressed overall ratio to 0.2918.","timestamp":1773652516539,"segment":0}
{"run":34,"commit":"b942f54","metric":0.2434062032837485,"metrics":{},"status":"discard","description":"perf(webrtc): test whether the newer 7 MiB/4 MiB SCTP buffer tuning remains strong without forcing node-datachannel mtu=1500; ratio collapsed to 0.2434, confirming that the large local win is still primarily coming from the MTU override rather than buffer tuning alone.","timestamp":1773652714864,"segment":0}
{"run":35,"commit":"b942f54","metric":0.27732498024630914,"metrics":{},"status":"discard","description":"perf(webrtc): probe a slightly more real-world-friendly node-datachannel MTU of 1492 instead of 1500 while keeping the 7 MiB/4 MiB SCTP buffers; ratio regressed sharply to 0.2773, so the local win remains very specific to the full 1500 setting.","timestamp":1773652847399,"segment":0}
{"run":36,"commit":"b942f54","metric":0.29089578872867,"metrics":{},"status":"discard","description":"perf(webrtc): make the node-datachannel PeerConnection path less node-specific by disabling ICE UDP mux entirely instead of enabling it on the server side; ratio regressed to 0.2909, so the current local best still depends somewhat on the existing mux setup.","timestamp":1773652994156,"segment":0}
{"run":37,"commit":"b942f54","metric":0.2603814284309914,"metrics":{},"status":"discard","description":"perf(webrtc): try reducing the shared transport chunk size by lowering MAX_MESSAGE_SIZE from 16 KiB to 8 KiB while keeping the current native tuning, to see if smaller framed records cooperate better with the MTU-sensitive data path; ratio regressed sharply to 0.2604.","timestamp":1773653234763,"segment":0}
{"run":38,"commit":"b942f54","metric":0.2878862173048823,"metrics":{},"status":"discard","description":"perf(webrtc): probe whether the shared write high-water mark has a local optimum just above 6 MiB by setting MAX_BUFFERED_AMOUNT to 6.5 MiB with the current native tuning; ratio regressed to 0.2879, so the 6 MiB setting still looks best.","timestamp":1773653365666,"segment":0}
{"run":39,"commit":"b942f54","metric":0.2918509290343071,"metrics":{},"status":"discard","description":"perf(webrtc): retest a more conservative shared write queue by lowering MAX_BUFFERED_AMOUNT from 6 MiB back to 4 MiB on top of the current MTU-sensitive native tuning; ratio regressed to 0.2919, so the current 6 MiB high-water mark still looks better even with mtu=1500.","timestamp":1773653532492,"segment":0}
{"run":40,"commit":"b942f54","metric":0.2896264922302956,"metrics":{},"status":"checks_failed","description":"perf(webrtc): probe whether removing the explicit node-datachannel PeerConnection maxMessageSize cap helps the native path while keeping mtu=1500; benchmark regressed and correctness checks failed with 'Failed to register ICE UDP mux listener', so discard.","timestamp":1773653833018,"segment":0}
{"run":41,"commit":"b942f54","metric":0.2902825776143512,"metrics":{},"status":"discard","description":"perf(webrtc): keep the shared transport chunk size at 16 KiB but raise the node-datachannel PeerConnection maxMessageSize advertisement from 16 KiB to 64 KiB to see if a looser native cap helps the MTU-tuned path; ratio regressed to 0.2903.","timestamp":1773653966662,"segment":0}
{"run":42,"commit":"b942f54","metric":0.2660344491288082,"metrics":{},"status":"discard","description":"perf(webrtc): probe whether the large native-path MTU win can be localized to one side by forcing node-datachannel mtu=1500 only for the server peer while leaving the client at default MTU; download stayed decent but upload collapsed and ratio regressed to 0.2660.","timestamp":1773654236862,"segment":0}
{"run":43,"commit":"b942f54","metric":0.2743740402388618,"metrics":{},"status":"discard","description":"perf(webrtc): probe whether the large native-path MTU win can be localized to one side by forcing node-datachannel mtu=1500 only for the client peer while leaving the server at default MTU; upload improved more than the server-only case but overall ratio still regressed to 0.2744.","timestamp":1773654380983,"segment":0}
{"run":44,"commit":"b942f54","metric":0,"metrics":{},"status":"crash","description":"perf(webrtc): prototype a tracked repo-side fast direct-path wrapper around node-datachannel data channels inside get-rtcpeerconnection.ts to reduce polyfill overhead without editing node_modules; the first cut failed to compile, so discard and inspect the type/build issues separately.","timestamp":1773654561737,"segment":0}
{"run":45,"commit":"b942f54","metric":0.3021806109252046,"metrics":{},"status":"discard","description":"perf(webrtc): prototype a tracked repo-side fast direct-path RTCDataChannel wrapper in get-rtcpeerconnection.ts so WebRTC-direct can bypass some node-datachannel polyfill message-event overhead without editing node_modules; the result was promising and faster overall, but still trailed the current best at 0.3022 vs 0.3099.","timestamp":1773654754344,"segment":0}
{"run":46,"commit":"b942f54","metric":0.29636983632431446,"metrics":{},"status":"discard","description":"bench: rerun the tracked repo-side fast direct-path RTCDataChannel wrapper in get-rtcpeerconnection.ts to check whether the first 0.3022 result was just noise; the rerun fell to 0.2964, so this wrapper still looks meaningfully below the current 0.3099 best.","timestamp":1773654889861,"segment":0}
{"run":47,"commit":"b942f54","metric":0.24667653972760883,"metrics":{},"status":"discard","description":"perf(webrtc): use the tracked repo-side fast direct-path RTCDataChannel wrapper but remove the forced mtu=1500 override to see how much of the remaining gap is polyfill overhead versus MTU/native behavior; the wrapper only lifted the default-MTU path slightly to 0.2467, far below the 0.3099 local best.","timestamp":1773655054071,"segment":0}
{"run":48,"commit":"b942f54","metric":0,"metrics":{},"status":"crash","description":"perf(webrtc): prototype a bigger tracked repo-side direct PeerConnection/DataChannel wrapper around raw node-datachannel to bypass more of the polyfill than the smaller RTCDataChannel-only wrapper; this first cut was functionally wrong and crashed during signaling with 'Unexpected local description type answer in signaling state stable'.","timestamp":1773655294701,"segment":0}
{"run":49,"commit":"b942f54","metric":0.30138632228938433,"metrics":{},"status":"discard","description":"perf(webrtc): refine the tracked repo-side fast direct-path RTCDataChannel wrapper so it skips EventTarget dispatch entirely when there are no listeners for open/close/error/bufferedamountlow/message, reducing more of the node-datachannel polyfill overhead on hot events; download throughput improved again but the ratio still trailed the 0.3099 best at 0.3014.","timestamp":1773655509944,"segment":0}
{"run":50,"commit":"b942f54","metric":0.29957396163419114,"metrics":{},"status":"discard","description":"perf(webrtc): with the refined tracked repo-side fast direct-path RTCDataChannel wrapper still in place, retune native SCTP send buffering from 7 MiB back up to 8 MiB to see if the wrapper-shifted bottleneck wants more native queueing; ratio fell slightly to 0.2996, so this wrapper still does not beat the current best even with retuned send buffering.","timestamp":1773655641132,"segment":0}
{"run":51,"commit":"b942f54","metric":0.30296952711614467,"metrics":{},"status":"discard","description":"perf(webrtc): force the underlying node-datachannel PeerConnection to use ICE UDP only by setting enableIceTcp=false alongside the current mtu=1500 + 7 MiB/4 MiB tuning; upload improved, but the overall ratio still trailed the best at 0.3030 vs 0.3099.","timestamp":1773655776611,"segment":0}
{"run":52,"commit":"b942f54","metric":0.29529836186957276,"metrics":{},"status":"discard","description":"bench: rerun the enableIceTcp=false native-path experiment to check whether its first 0.3030 result was just noise; the rerun dropped to 0.2953, so forcing UDP-only ICE still does not beat the current best.","timestamp":1773655895632,"segment":0}
{"run":53,"commit":"b942f54","metric":0.288906332549994,"metrics":{},"status":"discard","description":"perf(webrtc): force node-datachannel PeerConnections to bind explicitly to 127.0.0.1 so the direct benchmark gathers only loopback-relevant candidates; ratio regressed to 0.2889, so candidate binding is not the source of the current gap.","timestamp":1773656034350,"segment":0}
{"run":54,"commit":"b942f54","metric":0.28946104308494724,"metrics":{},"status":"discard","description":"perf(webrtc): probe a deeper libdatachannel/usrsctp knob by setting node-datachannel congestionControlModule=0 on top of the current 7 MiB/4 MiB + mtu=1500 tuning; ratio regressed to 0.2895, so this alternative congestion-control mode is not helping here.","timestamp":1773656198672,"segment":0}
{"run":55,"commit":"b942f54","metric":0.30496979145165765,"metrics":{},"status":"discard","description":"perf(webrtc): probe a second deeper libdatachannel/usrsctp congestion-control mode by setting node-datachannel congestionControlModule=1 on top of the current 7 MiB/4 MiB + mtu=1500 tuning; this was the best of the congestion-control probes so far at 0.3050, but it still trailed the current 0.3099 best.","timestamp":1773656327640,"segment":0}
{"run":56,"commit":"b942f54","metric":0.29793753163050263,"metrics":{},"status":"discard","description":"bench: rerun the congestionControlModule=1 native-path experiment to see whether the first 0.3050 result was noise; the rerun fell to 0.2979, so this setting still does not beat the current best.","timestamp":1773656445984,"segment":0}
{"run":57,"commit":"b942f54","metric":0.2981694725136772,"metrics":{},"status":"discard","description":"perf(webrtc): continue deeper libdatachannel/usrsctp probing by setting node-datachannel congestionControlModule=2 on top of the current 7 MiB/4 MiB + mtu=1500 tuning; ratio reached 0.2982, better than some native probes but still below the current best.","timestamp":1773656590377,"segment":0}
{"run":58,"commit":"b942f54","metric":0.2949777303309874,"metrics":{},"status":"discard","description":"perf(webrtc): combine the most promising deeper native probes by setting congestionControlModule=1 and forcing enableIceTcp=false alongside mtu=1500 + 7 MiB/4 MiB buffers; the combination regressed to 0.2950, so the knobs do not stack constructively.","timestamp":1773656751267,"segment":0}
{"run":59,"commit":"b942f54","metric":0.29032513187657294,"metrics":{},"status":"discard","description":"perf(webrtc): continue brute-force deeper libdatachannel/usrsctp probing by setting node-datachannel congestionControlModule=3 on top of the current 7 MiB/4 MiB + mtu=1500 tuning; ratio regressed to 0.2903.","timestamp":1773656895937,"segment":0}
{"run":60,"commit":"b942f54","metric":0.29329435211571653,"metrics":{},"status":"discard","description":"perf(webrtc): probe another deeper libdatachannel PeerConnection mode by setting forceMediaTransport=true alongside the current mtu=1500 + 7 MiB/4 MiB tuning; ratio regressed to 0.2933, so this alternative transport mode does not explain the remaining gap.","timestamp":1773657136665,"segment":0}
{"run":61,"commit":"b942f54","metric":0.2995962832598888,"metrics":{},"status":"discard","description":"perf(webrtc): explicitly enable ICE TCP alongside the current mtu=1500 + 7 MiB/4 MiB tuning to see whether the default transport selection is leaving performance on the table; upload improved but overall ratio still trailed the best at 0.2996.","timestamp":1773657268983,"segment":0}
{"run":62,"commit":"b942f54","metric":0.2899803881537898,"metrics":{},"status":"discard","description":"perf(webrtc): continue deeper libdatachannel/usrsctp probing by setting node-datachannel congestionControlModule=4 on top of the current 7 MiB/4 MiB + mtu=1500 tuning; ratio regressed to 0.2900.","timestamp":1773657426266,"segment":0}
{"run":63,"commit":"b942f54","metric":0.2864514389899957,"metrics":{},"status":"discard","description":"perf(webrtc): continue deeper libdatachannel/usrsctp probing by setting node-datachannel congestionControlModule=5 on top of the current 7 MiB/4 MiB + mtu=1500 tuning; ratio regressed further to 0.2865.","timestamp":1773657577564,"segment":0}
{"run":64,"commit":"b942f54","metric":0.28721258935649596,"metrics":{},"status":"discard","description":"perf(webrtc): revisit lower-level usrsctp startup behavior under the current mtu=1500 baseline by setting initialCongestionWindow=24 alongside the 7 MiB/4 MiB buffers; ratio regressed to 0.2872.","timestamp":1773657723381,"segment":0}
{"run":65,"commit":"b942f54","metric":0.27691157196391203,"metrics":{},"status":"discard","description":"perf(webrtc): try a smaller shared transport chunk size of 12 KiB instead of 16 KiB to see if slightly less SCTP fragmentation helps the MTU-sensitive native path without the overhead jump seen at 8 KiB; ratio still regressed sharply to 0.2769.","timestamp":1773657987939,"segment":0}
{"run":66,"commit":"b942f54","metric":0.28788018061030474,"metrics":{},"status":"discard","description":"bench: rerun the current best mtu=1500 + 7 MiB/4 MiB configuration to gauge drift after the latest native-path probes; this run came in much lower at 0.2879, reinforcing that benchmark noise remains substantial even though the large MTU-driven win has repeated before.","timestamp":1773658118323,"segment":0}
{"run":67,"commit":"b942f54","metric":0.30414476577391536,"metrics":{},"status":"discard","description":"perf(webrtc): combine the two least-bad deeper native probes by setting congestionControlModule=1 and explicitly enabling ICE TCP alongside the current mtu=1500 + 7 MiB/4 MiB tuning; the combination improved both upload and download versus some single probes but still trailed the 0.3099 best at 0.3041.","timestamp":1773658301934,"segment":0}
{"run":68,"commit":"b942f54","metric":0,"metrics":{},"status":"crash","description":"perf(webrtc): probe whether disabling libdatachannel auto ICE gathering reduces native overhead by setting disableAutoGathering=true alongside the current mtu=1500 + 7 MiB/4 MiB tuning; connection setup timed out immediately, so this mode is not viable here.","timestamp":1773658348531,"segment":0}
