{"run":205,"commit":"fb21bda","metric":0.30303035399324574,"metrics":{},"status":"discard","description":"diag(webrtc): compare the env-gated muxer/channel diagnostics on the current node-datachannel 0.29.0/libdatachannel 0.23.0 best path; repeated application channel-2 open/close cycles during the benchmark occur while the peer connection stays connected, only transitioning to closed at final teardown. That contrasts sharply with aggressive 0.32.1, where the peer connection itself closes immediately after the first application channel opens. The benchmark rerun stayed below the 0.3137 best at 0.3030.","timestamp":1773684258767,"segment":5}
{"run":206,"commit":"fb21bda","metric":0,"metrics":{},"status":"crash","description":"diag(webrtc): add env-gated DirectRTCPeerConnection.close() stack traces on top of the channel diagnostics and rerun aggressive node-datachannel 0.32.1/libdatachannel 0.24.0; no proactive application-side close call appears before failure. Instead, the first application channel opens, the peer connection flips to closed, and only then do our own reactive close paths run from connectionstatechange/final cleanup before the send path throws DataChannel is closed. That makes the aggressive 0.24.x failure look native-triggered rather than a deliberate JS-side teardown.","timestamp":1773684342817,"segment":5}
{"run":207,"commit":"fb21bda","metric":0,"metrics":{},"status":"crash","description":"diag(webrtc): build a smaller node-datachannel/polyfill two-channel repro for aggressive node-datachannel 0.32.1/libdatachannel 0.24.0 that uses a negotiated channel-0 handshake plus one application data channel under the same enableIceTcp/server-mux/mtu=1500/congestionControlModule=1/6MiB/4MiB settings; that minimal repro stays connected and successfully delivers a 16KiB send on the app channel, while the full libp2p benchmark still crashes. This strongly suggests the aggressive 0.24.x failure is not a generic native inability to open one extra data channel after handshake, but something triggered by the higher-level libp2p direct integration path after stream/channel setup.","timestamp":1773684583669,"segment":5}
{"run":208,"commit":"fb21bda","metric":0,"metrics":{},"status":"crash","description":"diag(webrtc): build a smaller stream-layer repro for aggressive node-datachannel 0.32.1/libdatachannel 0.24.0 that uses the repo's WebRTCStream framing/send path on top of a minimal polyfill handshake plus one app data channel; unlike the plain two-channel polyfill repro, this one reproduces the failure while pushing repeated 16KiB framed sends, reaching ~16 MiB before DataChannel is closed. That strongly localizes the aggressive 0.24.x fault to an interaction between libp2p's WebRTCStream send/framing behavior and the newer native stack, rather than to Noise/upgrader/perf logic above it.","timestamp":1773684751986,"segment":5}
{"run":209,"commit":"fb21bda","metric":0.3026508447100529,"metrics":{},"status":"discard","description":"diag(webrtc): compare the smaller stream-layer repro on the current node-datachannel 0.29.0/libdatachannel 0.23.0 best path; under the same aggressive enableIceTcp/server-mux/mtu=1500/congestionControlModule=1/6MiB/4MiB settings, the repo's WebRTCStream layer cleanly transfers 64 MiB and keeps both peer connections connected. That sharpens the localization from the paired 0.32.1 repro: the regression lives in the interaction between WebRTCStream's repeated framed sends and the newer native stack, not in the broader libp2p upgrade/perf machinery. The benchmark rerun landed at 0.3027, below the 0.3137 best.","timestamp":1773684960588,"segment":5}
{"run":210,"commit":"fb21bda","metric":0,"metrics":{},"status":"crash","description":"diag(webrtc): extend the smaller two-channel polyfill repro for aggressive node-datachannel 0.32.1/libdatachannel 0.24.0 from one 16KiB send to repeated direct RTCDataChannel sends totaling 64 MiB under the same 6MiB/4MiB/native-aggressive settings; this now reproduces the failure too, hitting Sending failed errno=32 at about 16 MiB sent with zero bytes delivered on the app channel. That means the newer aggressive regression is not specific to libp2p's protobuf framing/WebRTCStream logic after all; repeated post-handshake application-channel send volume alone is enough to trigger it.","timestamp":1773685083558,"segment":5}
{"run":211,"commit":"fb21bda","metric":0,"metrics":{},"status":"crash","description":"diag(webrtc): rerun the smaller repeated-send two-channel polyfill repro on aggressive node-datachannel 0.32.1/libdatachannel 0.24.0 with MTU unset/default while keeping enableIceTcp=true, server ICE UDP mux, congestionControlModule=1, and 6MiB/4MiB SCTP buffers; it still fails before delivering any app-channel bytes, now reaching about 8 MiB sent before DataChannel is closed. So the aggressive 0.24.x repeated-send regression does not require the forced 1500 MTU path, even though MTU magnifies the benchmarked failure surface.","timestamp":1773685151308,"segment":5}
{"run":212,"commit":"fb21bda","metric":0,"metrics":{},"status":"crash","description":"diag(webrtc): use the smaller repeated-send two-channel polyfill repro to test aggressive node-datachannel 0.32.1/libdatachannel 0.24.0 with enableIceTcp disabled while keeping server UDP mux, congestionControlModule=1, mtu=1500, and 6MiB/4MiB SCTP buffers; it still fails before delivering app-channel bytes, reaching about 8 MiB sent before Sending failed errno=32. That rules out explicit ICE TCP as the sole trigger in the smaller repeated-send regression surface.","timestamp":1773685315439,"segment":5}
{"run":213,"commit":"fb21bda","metric":0,"metrics":{},"status":"crash","description":"diag(webrtc): use the smaller repeated-send two-channel polyfill repro to test aggressive node-datachannel 0.32.1/libdatachannel 0.24.0 with server ICE UDP mux disabled while keeping enableIceTcp=true, congestionControlModule=1, mtu=1500, and 6MiB/4MiB SCTP buffers; unlike the mux-enabled case, the repro now cleanly transfers 64 MiB. That isolates server-side UDP mux as a key trigger for the newer repeated-send regression surface, even though the full libp2p benchmark still crashes under the unchanged default aggressive path.","timestamp":1773685348520,"segment":5}
{"run":214,"commit":"fb21bda","metric":0,"metrics":{},"status":"crash","description":"diag(webrtc): use the smaller repeated-send two-channel polyfill repro to test node-datachannel 0.32.1/libdatachannel 0.24.0 with the aggressive transport knobs still on (enableIceTcp=true, server UDP mux, mtu=1500, congestionControlModule=1) but the conservative queue shape from the benchmarkable setup (3MiB send, 2MiB recv, 2MiB buffered cap, 75% low watermark); the repro now cleanly transfers 64 MiB. That shows server-side UDP mux alone is not sufficient to trigger the newer regression in the small surface — the larger queue shape is also a key part of the failure — but the full libp2p benchmark still crashes under the unchanged default aggressive path.","timestamp":1773686806228,"segment":5}
{"run":215,"commit":"fb21bda","metric":0,"metrics":{},"status":"crash","description":"diag(webrtc): apply the smaller queue shape that stabilized the 0.32.1 repeated-send repro (3MiB send, 2MiB recv, 2MiB buffered cap, 75% low watermark) while keeping the aggressive transport knobs in the full benchmark (enableIceTcp=true, server UDP mux, mtu=1500, congestionControlModule=1); this no longer dies on the old immediate send errno path, but it still fails functionally mid-transfer after receiving only 25214955/536870912 bytes. That suggests the smaller queue shape mitigates the harshest aggressive 0.24.x failure mode but is not by itself enough to make the full aggressive benchmark correct.","timestamp":1773686922089,"segment":5}
{"run":216,"commit":"b077a12","metric":0.3428111466959902,"metrics":{},"status":"keep","description":"perf(webrtc): upgrade to node-datachannel 0.32.1/libdatachannel 0.24.0 and apply the mux/queue retune uncovered by the smaller repros — keep enableIceTcp=true, mtu=1500, congestionControlModule=1, but disable server-side ICE UDP mux and shrink the queue shape to sendBufferSize=3 MiB, recvBufferSize=2 MiB, MAX_BUFFERED_AMOUNT=2 MiB, and a 75% resume threshold; checks pass and webrtc_direct_tcp_ratio improves from 0.3137 to 0.3428, though this more native-heavy win still needs browser sanity validation.","timestamp":1773687193330,"segment":5}
{"run":217,"commit":"bc45b10","metric":0.3487076796437366,"metrics":{},"status":"keep","description":"perf(webrtc): on the new node-datachannel 0.32.1/libdatachannel 0.24.0 retune (enableIceUdpMux=false, mtu=1500, congestionControlModule=1, sendBufferSize=3 MiB, recvBufferSize=2 MiB, MAX_BUFFERED_AMOUNT=2 MiB, 75% resume threshold), remove explicit enableIceTcp; checks still pass and webrtc_direct_tcp_ratio improves further from 0.3428 to 0.3487, though this native-heavy winner still needs browser validation before broad trust.","timestamp":1773687431175,"segment":5}
{"run":218,"commit":"bc45b10","metric":0,"metrics":{},"status":"crash","description":"bench(browser): sanity-check the new native-heavy 0.32.1 winner against the host browser benchmark at 128 MiB / 2 throughput iterations before trusting it too much; the browser-to-node direct run timed out, so this current local optimum is still not yet validated on the real browser path and needs either a lighter browser workload or more targeted investigation before broader confidence.","timestamp":1773687485740,"segment":5}
{"run":219,"commit":"bc45b10","metric":0,"metrics":{},"status":"crash","description":"bench(browser): retry browser validation of the new 0.32.1 winner with a lighter 64 MiB / 1-iteration workload and longer measure timeout; the host browser benchmark still timed out, so the current local optimum remains unvalidated on the browser path and may be exploiting a node-native corner that does not generalize.","timestamp":1773687535579,"segment":5}
{"run":220,"commit":"bc45b10","metric":0,"metrics":{},"status":"crash","description":"perf(webrtc): test whether the new 0.32.1 retuned winner can keep most of its gain without the node-only mtu=1500 override by removing the explicit MTU while keeping enableIceTcp=false, enableIceUdpMux=false, congestionControlModule=1, sendBufferSize=3 MiB, recvBufferSize=2 MiB, MAX_BUFFERED_AMOUNT=2 MiB, and a 75% resume threshold; the benchmark timed out, so even this newer no-mux/small-queue winner still appears to depend materially on the forced MTU path.","timestamp":1773687677908,"segment":5}
{"run":221,"commit":"bc45b10","metric":0.3306288868288959,"metrics":{},"status":"discard","description":"perf(webrtc): retune the new 0.32.1 no-mux/small-queue winner by lowering sendBufferSize from 3 MiB to 2.5 MiB while keeping enableIceTcp=false, mtu=1500, congestionControlModule=1, recvBufferSize=2 MiB, MAX_BUFFERED_AMOUNT=2 MiB, and a 75% resume threshold; checks passed but webrtc_direct_tcp_ratio regressed from 0.3487 to 0.3306.","timestamp":1773687863422,"segment":5}
{"run":222,"commit":"bc45b10","metric":0,"metrics":{},"status":"crash","description":"diag(webrtc): re-enable server-side ICE UDP mux on the current 0.32.1 no-ICE-TCP/small-queue winner while keeping mtu=1500, congestionControlModule=1, sendBufferSize=3 MiB, recvBufferSize=2 MiB, MAX_BUFFERED_AMOUNT=2 MiB, and a 75% resume threshold. A lightweight host browser sanity run (16 MiB, 1 iteration) succeeds under mux-on, but the primary direct benchmark still fails functionally mid-transfer after receiving only 91652082/536870912 bytes, so mux restoration alone does not yield a safe high-throughput browser-shared configuration.","timestamp":1773688157699,"segment":5}
{"run":223,"commit":"bc45b10","metric":0.3391411204758705,"metrics":{},"status":"discard","description":"bench(webrtc): rerun the current 0.32.1 winner (enableIceTcp=false, enableIceUdpMux=false, mtu=1500, congestionControlModule=1, sendBufferSize=3 MiB, recvBufferSize=2 MiB, MAX_BUFFERED_AMOUNT=2 MiB, 75% resume threshold) while adding a lightweight host browser sanity run first (16 MiB, 1 throughput iteration, 1 latency iteration). The browser sanity check passes, so the no-mux winner is not outright incompatible with browser dial/transfer at small scale, but the primary ratio rerun lands at 0.3391 and still trails the kept 0.3487 while larger browser workloads remain timing out.","timestamp":1773688356937,"segment":5}
{"run":224,"commit":"bc45b10","metric":0.3418954613457861,"metrics":{},"status":"discard","description":"perf(webrtc): on the current 0.32.1 no-mux winner, increase recvBufferSize from 2 MiB to 2.5 MiB while keeping enableIceTcp=false, mtu=1500, congestionControlModule=1, sendBufferSize=3 MiB, MAX_BUFFERED_AMOUNT=2 MiB, and a 75% resume threshold; checks passed but webrtc_direct_tcp_ratio slipped from 0.3487 to 0.3419.","timestamp":1773688544126,"segment":5}
{"run":225,"commit":"bc45b10","metric":0.34115250361373206,"metrics":{},"status":"discard","description":"perf(webrtc): on the current 0.32.1 no-mux winner, raise the shared bufferedAmount resume threshold from 75% to 80% of MAX_BUFFERED_AMOUNT while keeping enableIceTcp=false, mtu=1500, congestionControlModule=1, sendBufferSize=3 MiB, recvBufferSize=2 MiB, and MAX_BUFFERED_AMOUNT=2 MiB; checks passed but webrtc_direct_tcp_ratio regressed from 0.3487 to 0.3412.","timestamp":1773688710140,"segment":5}
{"run":226,"commit":"bc45b10","metric":0.3459147228911197,"metrics":{},"status":"discard","description":"perf(webrtc): on the current 0.32.1 no-mux winner, raise MAX_BUFFERED_AMOUNT from 2 MiB to 3 MiB while keeping the 75% resume threshold, enableIceTcp=false, mtu=1500, congestionControlModule=1, sendBufferSize=3 MiB, and recvBufferSize=2 MiB; checks passed and throughput stayed close, but webrtc_direct_tcp_ratio still trailed the kept best at 0.3459 vs 0.3487.","timestamp":1773688881045,"segment":5}
{"run":227,"commit":"bc45b10","metric":0.34336044757290907,"metrics":{},"status":"discard","description":"perf(webrtc): on the current 0.32.1 no-mux winner, raise sendBufferSize from 3 MiB to 3.5 MiB while keeping enableIceTcp=false, mtu=1500, congestionControlModule=1, recvBufferSize=2 MiB, MAX_BUFFERED_AMOUNT=2 MiB, and a 75% resume threshold; checks passed but webrtc_direct_tcp_ratio regressed from 0.3487 to 0.3434.","timestamp":1773689048462,"segment":5}
{"run":228,"commit":"bc45b10","metric":0.33257699340136737,"metrics":{},"status":"discard","description":"perf(webrtc): on the current 0.32.1 no-mux winner, change congestionControlModule from 1 to 0 while keeping enableIceTcp=false, mtu=1500, sendBufferSize=3 MiB, recvBufferSize=2 MiB, MAX_BUFFERED_AMOUNT=2 MiB, and a 75% resume threshold; checks passed but webrtc_direct_tcp_ratio regressed materially from 0.3487 to 0.3326.","timestamp":1773689259869,"segment":5}
{"run":229,"commit":"bc45b10","metric":0.31407480878047245,"metrics":{},"status":"discard","description":"perf(webrtc): test a more browser-defensive MTU on the current 0.32.1 no-mux winner by lowering the explicit node MTU from 1500 to 1400 while keeping enableIceTcp=false, enableIceUdpMux=false, congestionControlModule=1, sendBufferSize=3 MiB, recvBufferSize=2 MiB, MAX_BUFFERED_AMOUNT=2 MiB, and a 75% resume threshold. A medium host browser sanity run at 32 MiB / 1 iteration now completes successfully (about 141 Mb/s up, 237 Mb/s down, 20 ms latency), but the primary direct benchmark drops sharply to 0.3141, so 1400 looks more robust for the browser smoke test yet too slow to keep.","timestamp":1773689554175,"segment":5}
{"run":230,"commit":"bc45b10","metric":0,"metrics":{},"status":"crash","description":"bench(browser): medium browser bisection on the current kept 0.32.1 winner (enableIceTcp=false, enableIceUdpMux=false, mtu=1500, congestionControlModule=1, sendBufferSize=3 MiB, recvBufferSize=2 MiB, MAX_BUFFERED_AMOUNT=2 MiB, 75% resume threshold). The primary direct benchmark still passes at 0.3399 on this rerun, but a 32 MiB / 1-iteration host browser run times out with `TimeoutError: signal timed out`, whereas the mtu=1400 variant completed that same browser workload. This reinforces that the current best is likely leaning on a node-local MTU corner that does not yet look robust on the browser path.","timestamp":1773689740581,"segment":5}
{"run":231,"commit":"bc45b10","metric":0,"metrics":{},"status":"crash","description":"perf(webrtc): probe whether a compromise MTU can preserve more of the current 0.32.1 no-mux winner while helping the browser path by lowering explicit node MTU from 1500 to 1450 and rerunning a 32 MiB host browser check plus the primary benchmark. The browser run still times out with `TimeoutError: signal timed out`, and the primary ratio also falls to 0.3224, so 1450 does not look like a useful browser-safe compromise.","timestamp":1773689957406,"segment":5}
{"run":232,"commit":"bc45b10","metric":0,"metrics":{},"status":"crash","description":"perf(webrtc): continue the browser-focused MTU bisection on the current 0.32.1 no-mux winner by lowering explicit node MTU from 1500 to 1420 and rerunning a 32 MiB host browser check plus the primary benchmark. The browser run still times out with `TimeoutError: signal timed out`, and the primary ratio stays far below the kept best at 0.3229, so the browser-viable region appears narrower than a simple small step down from 1500.","timestamp":1773690135626,"segment":5}
{"run":233,"commit":"bc45b10","metric":0,"metrics":{},"status":"crash","description":"perf(webrtc): try to recover some of the browser-viable mtu=1400 performance by increasing sendBufferSize from 3 MiB to 4 MiB while keeping the rest of the current 0.32.1 no-mux tuning (enableIceTcp=false, enableIceUdpMux=false, recvBufferSize=2 MiB, MAX_BUFFERED_AMOUNT=2 MiB, 75% resume threshold, congestionControlModule=1). The 32 MiB host browser run times out again and the primary ratio is only 0.3191, so the mtu=1400 browser pass does not tolerate simply restoring a larger aggressive send queue.","timestamp":1773690321199,"segment":5}
{"run":234,"commit":"bc45b10","metric":0.32530898248988743,"metrics":{},"status":"discard","description":"perf(webrtc): explore a broader queue-shape adjustment around the browser-viable mtu=1400 regime by raising MAX_BUFFERED_AMOUNT from 2 MiB to 3 MiB while keeping enableIceTcp=false, enableIceUdpMux=false, sendBufferSize=3 MiB, recvBufferSize=2 MiB, congestionControlModule=1, and a 75% resume threshold. This still completes the 32 MiB host browser run and improves that browser smoke result (about 165 Mb/s up, 264 Mb/s down, 3 ms latency) while lifting the primary ratio above the plain mtu=1400 variant to 0.3253, but it still trails the kept mtu=1500 best by a wide margin.","timestamp":1773690570801,"segment":5}
{"run":235,"commit":"bc45b10","metric":0,"metrics":{},"status":"crash","description":"perf(webrtc): continue around the browser-viable mtu=1400 + MAX_BUFFERED_AMOUNT=3 MiB regime by also raising the resume threshold from 75% to 80% of the buffered cap while keeping enableIceTcp=false, enableIceUdpMux=false, sendBufferSize=3 MiB, recvBufferSize=2 MiB, and congestionControlModule=1. The 32 MiB host browser run times out again and the primary ratio falls to 0.3181, so the browser-tolerant 1400/3 MiB buffered regime appears to want the more conservative 75% wakeup point.","timestamp":1773690778974,"segment":5}
{"run":236,"commit":"bc45b10","metric":0.3102923333801601,"metrics":{},"status":"discard","description":"perf(webrtc): continue exploring the browser-viable mtu=1400 + MAX_BUFFERED_AMOUNT=3 MiB regime by increasing recvBufferSize from 2 MiB to 2.5 MiB while keeping enableIceTcp=false, enableIceUdpMux=false, sendBufferSize=3 MiB, congestionControlModule=1, and a 75% resume threshold. The 32 MiB host browser run still completes and even improves its smoke numbers (about 219 Mb/s up, 268 Mb/s down, 7 ms latency), but the primary direct benchmark falls to 0.3103, so larger recv buffering looks too costly here.","timestamp":1773691064832,"segment":5}
{"run":237,"commit":"bc45b10","metric":0,"metrics":{},"status":"crash","description":"perf(webrtc): probe whether the browser-viable mtu=1400 + MAX_BUFFERED_AMOUNT=3 MiB regime can recover more primary throughput with a moderate send-queue increase by raising sendBufferSize from 3 MiB to 3.5 MiB while restoring recvBufferSize to 2 MiB and keeping enableIceTcp=false, enableIceUdpMux=false, congestionControlModule=1, and a 75% resume threshold. The 32 MiB host browser run times out again and the primary ratio only reaches 0.3216, so even a partial move back toward the larger aggressive send queue appears to re-break the browser path.","timestamp":1773691258537,"segment":5}
{"run":238,"commit":"bc45b10","metric":0,"metrics":{},"status":"crash","description":"bench(browser): continue browser workload bisection on the current kept 0.32.1 winner (enableIceTcp=false, enableIceUdpMux=false, mtu=1500, congestionControlModule=1, sendBufferSize=3 MiB, recvBufferSize=2 MiB, MAX_BUFFERED_AMOUNT=2 MiB, 75% resume threshold) by lowering the host browser transfer from 32 MiB to 24 MiB. The browser run still times out even though the primary direct benchmark remains strong at 0.3453 on this rerun, so the browser failure threshold for the kept mtu=1500 config is below 24 MiB but above the previously passing 16 MiB smoke test.","timestamp":1773691435283,"segment":5}
