{"run":308,"commit":"a52027b","metric":0,"metrics":{},"status":"crash","description":"diag(browser): continue adding a temporary browser-harness switch to test whether the heavy 96 MiB failure depends on reusing the same connection across upload then download. The first no-reuse attempt exposed another small harness bug (`ReferenceError: BROWSER_REUSE_EXISTING_CONNECTION is not defined`), so this diagnostic still needs one final fix before it can run.","timestamp":1773709106021,"segment":5}
{"run":309,"commit":"a52027b","metric":0,"metrics":{},"status":"crash","description":"diag(browser): test whether the current 96 MiB browser failure is caused by reusing the same connection across upload then download by rerunning the full browser workflow with `reuseExistingConnection=false`. It still fails, and diagnostics show a late download-phase stall after about 38 MiB of download progress. So the heavy browser failure is not explained simply by reusing the same perf connection across phases; it persists even when each measurePerformance call opens a fresh connection.","timestamp":1773709295398,"segment":5}
{"run":310,"commit":"a52027b","metric":0.34585977289828773,"metrics":{},"status":"discard","description":"diag(browser): isolate the other side of the no-reuse hypothesis by running the current config in download-only mode at 96 MiB with `reuseExistingConnection=false` before rerunning the primary benchmark. That still completes cleanly (about 273 Mb/s download), which means the 96 MiB failure in the full upload+download browser workflow is not caused by download alone, nor by download on a fresh connection. Combined with the earlier upload-only success and full-workflow failures, the problem now looks like state carried over by doing a large upload phase before the large download phase inside the same browser benchmark session, rather than simple one-way transfer instability.","timestamp":1773709474512,"segment":5}
{"run":311,"commit":"a52027b","metric":0.3507422350787156,"metrics":{},"status":"discard","description":"diag(browser): temporarily extend the browser harness so the full 96 MiB upload+download workflow can either reuse one browser libp2p dialer across phases or create a fresh dialer per phase. Running the current kept config with a fresh dialer per phase makes the previously failing 96 MiB full browser workload complete cleanly. Combined with earlier upload-only and download-only successes, this is the strongest evidence so far that the remaining heavy browser failure comes from state retained inside one browser libp2p node/session across phases, not from a one-way transfer limit and not from the shared transport code alone. The primary benchmark rerun stays just below the kept best at 0.3507.","timestamp":1773710035729,"segment":5}
{"run":312,"commit":"a52027b","metric":0,"metrics":{},"status":"crash","description":"diag(browser): after the fresh-dialer-per-phase success, try the next narrowing step by running the full 96 MiB browser workflow on a single dialer but without the initial priming `dial()` connection. This attempt did not run because the temporary browser-client patch was corrupted during editing and esbuild failed to parse `benchmark/webrtc-browser-client.ts`. The intended next diagnostic still stands: determine whether the priming connection is part of the retained browser-session state that triggers the heavy upload-then-download failure.","timestamp":1773711899790,"segment":5}
{"run":313,"commit":"a52027b","metric":0,"metrics":{},"status":"crash","description":"diag(browser): after the fresh-dialer-per-phase pass and the shared-dialer-no-prime early upload stall, try one more narrowing step by keeping a single browser dialer but explicitly `hangUp(target)` between the 96 MiB upload and download phases. That crashes the node side with `libdatachannel error while sending data channel message: Sending failed, errno=32` from `WebRTCStream` on `onbufferedamountlow`, which is strong evidence that phase-to-phase cleanup / close handling is leaving a stale send path alive rather than cleanly quiescing before the next phase. So the retained-state problem now looks much closer to connection teardown / buffered send resumption semantics than to simple browser priming alone.","timestamp":1773712326566,"segment":5}
{"run":314,"commit":"a52027b","metric":0,"metrics":{},"status":"crash","description":"diag(webrtc): harden `WebRTCStream` send resumption around close/teardown by ignoring `onbufferedamountlow` after the stream/channel stops being writable and by catching `RTCDataChannel.send()` errors inside `sendData`, aborting the stream instead of letting the send throw out of the drain path. In the paired diagnostic run the primary benchmark unexpectedly improved to 0.3550, but the standard 96 MiB browser upload+download workflow still timed out in the late download phase after about 41 MiB of progress, so browser relevance is still unresolved. Because this combined diagnostic command failed on the browser side, the run did not clear the normal keep path and needs a clean benchmark+checks rerun if this guard is worth pursuing.","timestamp":1773712795727,"segment":5}
{"run":315,"commit":"a52027b","metric":0,"metrics":{},"status":"crash","description":"diag(webrtc): validate the send-resumption/close-guard patch in `WebRTCStream` against the minimum browser-relevance bar by reverting the temporary browser-harness diagnostics and rerunning the standard browser benchmark at 32 MiB before the primary benchmark. This patch regresses browser behavior badly: the 32 MiB browser workflow times out where the kept 70% baseline normally passes, and the primary rerun also slips to 0.3468. So the close/drain guard idea as implemented is not a keep candidate despite the earlier one-off 0.3550 primary result.","timestamp":1773713017986,"segment":5}
{"run":316,"commit":"a52027b","metric":0,"metrics":{},"status":"crash","description":"diag(browser): temporarily add a shared-dialer `hangUp + wait-for-no-connections` phase strategy to test whether the 96 MiB browser upload-then-download failure is just asynchronous connection teardown after upload. It is not. Waiting until the shared dialer's connection manager reports zero live connections avoids the earlier immediate `errno=32` crash, but the download phase still times out later after about 34 MiB of progress. That means the retained bad state is not explained solely by a not-yet-closed connection; it survives even after the old connection is fully gone from the browser dialer's connection table.","timestamp":1773713445377,"segment":5}
{"run":317,"commit":"a52027b","metric":0.34744953440892656,"metrics":{},"status":"discard","description":"diag(browser): temporarily add a shared-dialer `close(priming connection) + wait-for-no-connections` phase strategy to test whether the retained 96 MiB browser failure is specifically tied to `hangUp()`-style teardown on the shared browser dialer. This full upload+download workflow now completes cleanly at 96 MiB on a single shared dialer. Together with the earlier fresh-dialer-per-phase pass and the contrasting `hangUp()+wait` late-download failure, this strongly points to the bad retained state living in the shared dialer's teardown path rather than in one-way transfer throughput itself. The primary benchmark rerun is solid at 0.3474 but still below the kept 0.3515 best.","timestamp":1773713752543,"segment":5}
{"run":318,"commit":"a52027b","metric":0,"metrics":{},"status":"crash","description":"diag(browser): temporarily test whether the priming connection only needs to warm up the shared browser dialer by closing that priming connection and waiting for zero live connections *before* starting the 96 MiB upload+download workflow. It does not work. Upload falls back to the earlier `recentOutputs=[]` start stall, even though the later diagnostic showed that closing the priming connection *after* upload lets the subsequent download succeed. So the priming connection appears to be necessary for the first heavy upload phase, but harmful if it remains in place for the later download phase.","timestamp":1773714176415,"segment":5}
{"run":319,"commit":"a52027b","metric":0.344780514014671,"metrics":{},"status":"discard","description":"diag(libp2p/browser): temporarily simplify `connectionManager.closeConnections()` to close each connection directly instead of waiting on `pEvent(connection,'close')` and `connection.close()` in parallel, then rerun the previously bad shared-dialer `hangUp()+wait-for-zero-connections` browser workflow at 96 MiB. That workflow now completes cleanly. This is the strongest evidence so far that the bad retained browser state is in the connection-manager `hangUp` teardown path itself rather than in unavoidable browser/session reuse. The primary benchmark rerun lands at 0.3448, below the kept 0.3515 best, so this is a diagnostic narrowing rather than a keep candidate yet.","timestamp":1773714519933,"segment":5}
{"run":320,"commit":"a52027b","metric":0.35009805426797125,"metrics":{},"status":"discard","description":"diag(libp2p/browser): refine the `closeConnections()` diagnosis by keeping the close-event wait but sequencing it as `const closeEvent = pEvent(...); await connection.close(); await closeEvent` instead of awaiting the event and `connection.close()` in parallel. With that narrower patch, the previously failing shared-dialer `hangUp()+wait-for-zero-connections` 96 MiB browser workflow also completes cleanly. So the likely problem is not `closeConnections()` in general, but the parallel teardown sequencing in the current implementation. The primary benchmark rerun is decent at 0.3501 but still below the kept 0.3515 best.","timestamp":1773714830997,"segment":5}
{"run":321,"commit":"a52027b","metric":0.3416470820238084,"metrics":{},"status":"discard","description":"diag(node/browser): add a tracked node-only shared-dialer phase repro that mirrors the browser harness structure more closely — explicit initial dial, then a 96 MiB upload perf run followed by a 96 MiB download perf run on the same libp2p dialer with `reuseExistingConnection=true`. On Node↔Node this completes cleanly in both directions. So the remaining heavy failure still does not reproduce in the shared libp2p/perf workflow outside the browser, which strengthens the case that the bad state is browser-specific or browser+shared-dialer teardown specific rather than a general libp2p perf sequencing bug. The primary benchmark rerun is well below the kept best at 0.3416.","timestamp":1773715147967,"segment":5}
{"run":322,"commit":"a52027b","metric":0,"metrics":{},"status":"crash","description":"diag(browser): temporarily add a simple `waitBetweenPhasesMs` to the standard shared-browser-dialer harness and test whether giving teardown/cleanup time alone is enough to make the 96 MiB upload-then-download workflow reliable. A 1 s wait does not help. The browser run still times out, and the failure signature falls back to `recentOutputs=[]`, so merely waiting is not equivalent to explicitly closing/replacing the priming connection. That makes the problem look more like connection/session state than delayed cleanup that just needs time to settle.","timestamp":1773715393854,"segment":5}
{"run":323,"commit":"a52027b","metric":0.35023301237953613,"metrics":{},"status":"discard","description":"diag(node/browser): extend the tracked node-only shared-dialer phase repro so it can close the initial priming connection *before* starting the heavy upload, then retry the 96 MiB upload+download workflow. On Node↔Node that still completes cleanly. This contrasts directly with the browser path, where closing the priming connection before upload reintroduced the `recentOutputs=[]` start stall. So the priming-connection dependency itself now looks browser-specific, not a general libp2p/perf requirement. The primary benchmark rerun is close at 0.3502 but still below the kept 0.3515 best.","timestamp":1773715586489,"segment":5}
{"run":324,"commit":"a52027b","metric":0.3471361810590198,"metrics":{},"status":"discard","description":"diag(browser): instrument the standard shared-browser-dialer 96 MiB workflow to snapshot `dialer.getConnections(remotePeer)` after the initial dial, after upload, after download, and after latency. This particular rerun completes successfully, and all snapshots show exactly one still-open outbound connection with the same id across the whole upload→download→latency sequence. That supports the working model that the standard browser harness is usually reusing the original priming connection for both heavy phases, but because this rerun passed it does not yet explain why some runs still fail. The primary benchmark rerun lands at 0.3471, below the kept best.","timestamp":1773715997393,"segment":5}
{"run":325,"commit":"a52027b","metric":0,"metrics":{},"status":"crash","description":"diag(browser): instrument the standard shared-browser-dialer 96 MiB workflow to wait until `dialer.getConnections(remotePeer)` becomes empty after upload, to test whether the bad download start simply races a naturally closing priming connection. That is not a general fix. In this run the connection never disappeared at all within the timeout, staying open after upload, so the harness failed waiting for zero connections. This contrasts with the earlier failed snapshot run where the same connection already had a `timeline.close` after upload and was gone by the time download failed. So the browser path now clearly has at least two distinct shared-dialer states after upload: one where the priming connection is already closing/gone before download, and another where it remains open indefinitely. That strengthens the conclusion that browser-specific connection lifecycle state, not just transfer throughput, is driving the heavy-workload instability.","timestamp":1773716475084,"segment":5}
{"run":326,"commit":"a52027b","metric":0,"metrics":{},"status":"crash","description":"diag(native): start probing a deeper lower-stack swap by rebuilding node-datachannel 0.32.1 against libdatachannel v0.24.1 instead of v0.24.0 before the primary benchmark. This first attempt failed immediately because the scripted patch step assumed `python` was available on the host; rerun with `python3` or a shell edit instead.","timestamp":1773717013798,"segment":5}
{"run":327,"commit":"a52027b","metric":0,"metrics":{},"status":"crash","description":"diag(native): retry rebuilding node-datachannel 0.32.1 against libdatachannel v0.24.1 before the primary benchmark. The lower-stack swap itself started cleanly, but the source-build recipe was incomplete: after cleaning, cmake-js failed because node-datachannel's local dev headers (`napi.h` from node-addon-api) were not installed. Next rerun needs the package's own `npm install --ignore-scripts --production=false` step before configure/build.","timestamp":1773717261812,"segment":5}
{"run":328,"commit":"a52027b","metric":0,"metrics":{},"status":"crash","description":"diag(native): complete the lower-stack source-build path for node-datachannel 0.32.1 + libdatachannel v0.24.1. The native build itself now succeeds once local dev deps are installed, but the package's `build:tsc` step fails under this host toolchain, and because `clean` removed the published `dist/` bundle the module becomes unloadable afterward. Next rerun should preserve the shipped JS `dist/` files and rebuild only the native `.node` artifact.","timestamp":1773717604264,"segment":5}
{"run":329,"commit":"a52027b","metric":0.32522502010477605,"metrics":{},"status":"discard","description":"diag(native): rebuild node-datachannel 0.32.1 against libdatachannel v0.24.1 (still on the default libjuice/OpenSSL path), preserving the published JS dist and swapping only the native `.node` artifact before the primary benchmark. This deeper lower-stack patch builds and passes checks, but the primary ratio falls to 0.3252 (about 351.6 Mb/s up, 367.3 Mb/s down), well below the kept 0.3515 best. So the 0.24.1 patch release does not help on its own.","timestamp":1773718048139,"segment":5}
{"run":330,"commit":"a52027b","metric":0,"metrics":{},"status":"crash","description":"diag(native): rebuild node-datachannel 0.32.1 against the original libdatachannel v0.24.0 but switch the lower TLS stack from OpenSSL to GnuTLS (`cmake-js configure --CDUSE_GNUTLS=1`). The native build succeeds and reports libdatachannel 0.24.0, but the primary benchmark now fails immediately during the secure-handshake path with `UnexpectedEOF` in noise/stream setup. So this lower-stack swap is functionally incompatible here, at least in the current integration/configuration.","timestamp":1773718337613,"segment":5}
{"run":331,"commit":"a52027b","metric":0,"metrics":{},"status":"crash","description":"diag(native): retest the GNU TLS lower-stack swap on the libdatachannel v0.24.x patch line by rebuilding node-datachannel 0.32.1 against libdatachannel v0.24.1 with `USE_GNUTLS=1`. The rebuilt addon clearly links against `libgnutls.so.30`, `libnettle`, `libhogweed`, and `libgmp`, but the primary benchmark fails in the same way as the v0.24.0 GNU TLS build: immediate `UnexpectedEOF` during the inbound noise/stream handshake. So the incompatibility is tied to the GNU TLS backend itself here, not just v0.24.0.","timestamp":1773718619607,"segment":5}
