{"run":168,"commit":"fb21bda","metric":0,"metrics":{},"status":"crash","description":"perf(webrtc): continue underlying-package exploration by upgrading the transport from node-datachannel 0.29.0 to 0.31.0 (libdatachannel 0.24.0) now that the current tree builds cleanly against its typings without extra source patches; the benchmark still failed almost immediately at runtime with libdatachannel send errors (Sending failed, errno=32), so newer libdatachannel is not a drop-in win here either.","timestamp":1773673556901,"segment":5}
{"run":169,"commit":"fb21bda","metric":0,"metrics":{},"status":"crash","description":"perf(webrtc): continue underlying-package exploration by upgrading from node-datachannel 0.29.0 to 0.32.0 (libdatachannel 0.24.0) to see whether the 0.32 line differs materially from the already-crashy 0.32.1 release; it failed almost immediately with the same libdatachannel send error (Sending failed, errno=32), so this package line still is not drop-in viable.","timestamp":1773673645513,"segment":5}
{"run":170,"commit":"fb21bda","metric":0,"metrics":{},"status":"crash","description":"perf(webrtc): probe whether the newer libdatachannel 0.24 line just needs the safer native MTU surface by upgrading to node-datachannel 0.32.0 but removing the forced PeerConnection mtu=1500 override, which raw native probes had already flagged as unstable; the benchmark still crashed quickly because the data channel closed during early sends, so the 0.24 package line remains unstable even off the large-MTU path.","timestamp":1773673733048,"segment":5}
{"run":171,"commit":"fb21bda","metric":0.3071968099354294,"metrics":{},"status":"discard","description":"perf(webrtc): now that cmake is available, rebuild node-datachannel 0.29.0 (libdatachannel 0.23.0, default libjuice path) from source with cmake-js instead of using the shipped prebuilt binary, then rerun the anchored 5-iteration benchmark; the source-built native stack stayed stable and competitive but still trailed the current best at webrtc_direct_tcp_ratio=0.3072 versus 0.3137.","timestamp":1773674487576,"segment":5}
{"run":172,"commit":"fb21bda","metric":0,"metrics":{},"status":"crash","description":"perf(webrtc): now that cmake is available, source-build node-datachannel 0.31.0 (libdatachannel 0.24.0, default libjuice path) with cmake-js plus local devDependencies to see whether the earlier 0.31 runtime failure was a prebuilt artifact rather than a real stack regression; the benchmark still failed almost immediately with the same libdatachannel send error (Sending failed, errno=32), so this 0.24 stack issue survives a local source build too.","timestamp":1773674848743,"segment":5}
{"run":173,"commit":"fb21bda","metric":0,"metrics":{},"status":"crash","description":"perf(webrtc): try a source-built node-datachannel 0.30.0 (libdatachannel 0.23.0, default libjuice path) now that cmake is available; the native addon built successfully, but the transport package no longer type-checks because several existing @ts-expect-error compatibility comments become unused under 0.30.0, so this run crashed at build time before reaching the benchmark.","timestamp":1773675163593,"segment":5}
{"run":174,"commit":"fb21bda","metric":0.3005961639432819,"metrics":{},"status":"discard","description":"perf(webrtc): with cmake now available, source-build node-datachannel 0.30.0 (libdatachannel 0.23.0, default libjuice path) and loosen the now-unused compatibility comments from @ts-expect-error to @ts-ignore so the transport builds cleanly; the benchmark stayed stable but still regressed to webrtc_direct_tcp_ratio=0.3006, so this package line remains below the 0.29.0 best even when locally built.","timestamp":1773675446166,"segment":5}
{"run":175,"commit":"fb21bda","metric":0.3046118302743124,"metrics":{},"status":"discard","description":"perf(webrtc): with cmake available, source-build node-datachannel 0.29.0 (libdatachannel 0.23.0) with the node addon compiled without media and websocket wrapper targets via NO_MEDIA/NO_WEBSOCKET, to see whether trimming unused native surfaces helps the datachannel hot path; the benchmark remained stable but still trailed the best at webrtc_direct_tcp_ratio=0.3046 versus 0.3137.","timestamp":1773676088587,"segment":5}
{"run":176,"commit":"fb21bda","metric":0,"metrics":{},"status":"crash","description":"perf(webrtc): try to make newer libdatachannel 0.24.x benchmarkable by upgrading to node-datachannel 0.31.0 while backing off the current native-heavy peer-connection knobs, removing both enableIceTcp=true and the forced mtu=1500 override; it still failed almost immediately with the same libdatachannel send error (Sending failed, errno=32), so the early-send/runtime failure is not just a byproduct of those aggressive transport settings.","timestamp":1773676342106,"segment":5}
{"run":177,"commit":"fb21bda","metric":0,"metrics":{},"status":"crash","description":"perf(webrtc): try to make node-datachannel 0.31.0 / libdatachannel 0.24.0 benchmarkable by following the raw-native stability signal, backing the queue shape down to a 1 MiB WebRTC buffered limit, 2 MiB SCTP send/recv buffers, a 75% resume threshold, and no explicit congestionControlModule while also keeping enableIceTcp/mtu disabled; this got past the immediate errno=32 send crash but transfers still failed functionally, stalling with zero bytes received in the throughput run.","timestamp":1773676569607,"segment":5}
{"run":178,"commit":"fb21bda","metric":0,"metrics":{},"status":"crash","description":"perf(webrtc): continue probing whether newer libdatachannel 0.24.x just needs a smaller queue shape by keeping node-datachannel 0.31.0 on the safer no-enableIceTcp/no-mtu configuration with 2 MiB SCTP send/recv buffers and no explicit congestionControlModule, but relaxing the WebRTC bufferedAmount cap from 1 MiB to 2 MiB while keeping a 75% resume threshold; transfers still stalled before completion, so simply moving the queue cap toward the old baseline does not recover a usable 0.24 direct stack.","timestamp":1773676844158,"segment":5}
{"run":179,"commit":"fb21bda","metric":0,"metrics":{},"status":"crash","description":"perf(webrtc): push the node-datachannel 0.31.0 / libdatachannel 0.24.0 setup closer to the raw-native benchmark that can stay stable by disabling server-side ICE UDP mux as well, while keeping the safer no-enableIceTcp/no-mtu path, 2 MiB SCTP send/recv buffers, a 1 MiB bufferedAmount cap, a 75% resume threshold, and no explicit congestionControlModule; this improved functional progress materially but still stalled mid-transfer after receiving 142573554/536870912 bytes.","timestamp":1773677034677,"segment":5}
{"run":180,"commit":"fb21bda","metric":0.25918575216369977,"metrics":{},"status":"discard","description":"perf(webrtc): keep pushing node-datachannel 0.31.0 / libdatachannel 0.24.0 toward a fair benchmarkable configuration by disabling server-side ICE UDP mux and using the raw-benchmark-inspired conservative queue shape (2 MiB SCTP send/recv, 2 MiB WebRTC bufferedAmount cap, 75% resume threshold, no explicit congestionControlModule, no forced ICE TCP, no forced mtu); this finally completed and benchmarked cleanly, but the ratio only reached 0.2592, well below the current 0.3137 best on 0.29.0.","timestamp":1773677239448,"segment":5}
{"run":181,"commit":"fb21bda","metric":0,"metrics":{},"status":"crash","description":"perf(webrtc): now that node-datachannel 0.31.0 / libdatachannel 0.24.0 is finally benchmarkable under the conservative no-mtu/no-ICE-TCP/no-ICE-UDP-mux configuration, retest the known-good older native congestion-control tweak by restoring congestionControlModule=1 on top of the 2 MiB/2 MiB/2 MiB queue shape; this destabilized the run again and timed out, so the 0.24 line does not tolerate that older win directly.","timestamp":1773677426053,"segment":5}
{"run":182,"commit":"fb21bda","metric":0.25303242235192724,"metrics":{},"status":"discard","description":"perf(webrtc): tune the newly benchmarkable node-datachannel 0.31.0 / libdatachannel 0.24.0 safe configuration using the raw-native signal that a 3 MiB SCTP send buffer is stable and faster than 2 MiB with a 2 MiB receive buffer, while keeping the 2 MiB WebRTC bufferedAmount cap, 75% resume threshold, no forced ICE TCP, no forced mtu, and no ICE UDP mux; the full libp2p benchmark still regressed slightly to 0.2530 versus the 0.2592 2 MiB-send variant.","timestamp":1773677660121,"segment":5}
{"run":183,"commit":"fb21bda","metric":0.2566483302001318,"metrics":{},"status":"discard","description":"perf(webrtc): retune flow control on the newly benchmarkable node-datachannel 0.31.0 / libdatachannel 0.24.0 safe configuration by restoring the older 82% bufferedAmount resume threshold while keeping 2 MiB SCTP send/recv buffers, a 2 MiB bufferedAmount cap, no forced ICE TCP, no forced mtu, and no ICE UDP mux; this stayed stable but still trailed the 75% variant at 0.2566 versus 0.2592.","timestamp":1773677863721,"segment":5}
{"run":184,"commit":"fb21bda","metric":0.25583103872703394,"metrics":{},"status":"discard","description":"perf(webrtc): continue the newly unlocked fair benchmarking of libdatachannel 0.24.x by upgrading the conservative safe configuration from node-datachannel 0.31.0 to 0.32.0 while keeping no forced ICE TCP, no forced mtu, no server-side ICE UDP mux, 2 MiB SCTP send/recv buffers, a 2 MiB bufferedAmount cap, and a 75% resume threshold; it completed cleanly but still reached only 0.2558, slightly below the 0.31.0 safe result and far below the 0.29.0 best.","timestamp":1773678214358,"segment":5}
{"run":185,"commit":"fb21bda","metric":0.2757192893376435,"metrics":{},"status":"discard","description":"perf(webrtc): continue the fair libdatachannel 0.24.x sweep by upgrading the conservative safe configuration from node-datachannel 0.32.0 to 0.32.1 while keeping no forced ICE TCP, no forced mtu, no server-side ICE UDP mux, 2 MiB SCTP send/recv buffers, a 2 MiB bufferedAmount cap, and a 75% resume threshold; this version benchmarked cleanly and improved the 0.24 line to 0.2757, but it still remained well below the current 0.3137 best on node-datachannel 0.29.0.","timestamp":1773678424568,"segment":5}
{"run":186,"commit":"fb21bda","metric":0.27966127565036947,"metrics":{},"status":"discard","description":"perf(webrtc): retune the best-so-far fair libdatachannel 0.24.x setup on node-datachannel 0.32.1 using the raw-native hint that a slightly larger send buffer can help, raising SCTP sendBufferSize from 2 MiB to 3 MiB while keeping recvBufferSize=2 MiB, no forced ICE TCP, no forced mtu, no server-side ICE UDP mux, a 2 MiB bufferedAmount cap, and a 75% resume threshold; this improved the 0.24 line further to 0.2797 but still remained well below the 0.3137 best on 0.29.0.","timestamp":1773678610321,"segment":5}
{"run":187,"commit":"fb21bda","metric":0.27810313686262256,"metrics":{},"status":"discard","description":"perf(webrtc): continue retuning the fair node-datachannel 0.32.1 / libdatachannel 0.24.x setup by raising SCTP sendBufferSize again from 3 MiB to 4 MiB while keeping recvBufferSize=2 MiB, no forced ICE TCP, no forced mtu, no server-side ICE UDP mux, a 2 MiB bufferedAmount cap, and a 75% resume threshold; the run stayed stable but slipped slightly to 0.2781, so the local optimum in this safer 0.24 regime appears to be near 3 MiB send.","timestamp":1773678802126,"segment":5}
{"run":188,"commit":"fb21bda","metric":0,"metrics":{},"status":"crash","description":"perf(webrtc): directly test whether server-side ICE UDP mux is the key integration fault on the fair libdatachannel 0.24.x setup by taking the best benchmarkable node-datachannel 0.32.1 conservative config (3 MiB send, 2 MiB recv, 2 MiB bufferedAmount cap, 75% resume threshold, no forced ICE TCP, no forced mtu) and re-enabling the default server-side enableIceUdpMux path; the run failed functionally with zero bytes received, reinforcing that server-side ICE UDP mux is a major part of why the 0.24 line only works under the raw-native-like regime.","timestamp":1773679021218,"segment":5}
{"run":189,"commit":"fb21bda","metric":0.272613087729151,"metrics":{},"status":"discard","description":"perf(webrtc): test whether the best fair libdatachannel 0.24.x setup is being limited by the shipped prebuilt binary by source-building node-datachannel 0.32.1 with cmake-js, then rerunning the conservative direct-path configuration (3 MiB send, 2 MiB recv, 2 MiB bufferedAmount cap, 75% resume threshold, no forced ICE TCP, no forced mtu, no server-side ICE UDP mux); the locally built addon stayed stable but reached only 0.2726, slightly below the 0.2797 prebuilt result and still far below the 0.29.0 best.","timestamp":1773679514570,"segment":5}
{"run":190,"commit":"fb21bda","metric":0,"metrics":{},"status":"crash","description":"perf(webrtc): test whether the old native win from explicit ICE TCP can help the fair libdatachannel 0.24.x setup by re-enabling enableIceTcp=true on top of the source-built node-datachannel 0.32.1 conservative configuration (3 MiB send, 2 MiB recv, 2 MiB bufferedAmount cap, 75% resume threshold, no forced mtu, no server-side ICE UDP mux); the benchmark crashed again during stream send/drain handling before producing a metric, so this older ICE TCP win does not transfer cleanly to the 0.24 line either.","timestamp":1773679789248,"segment":5}
{"run":191,"commit":"fb21bda","metric":0,"metrics":{},"status":"crash","description":"perf(webrtc): investigate whether server-side ICE UDP mux is a general source of the current native win or specifically a 0.24.x fault line by disabling enableIceUdpMux on the current 0.29.0 best configuration while keeping enableIceTcp=true, mtu=1500, sendBufferSize=6 MiB, recvBufferSize=4 MiB, congestionControlModule=1, and the 82% resume threshold; the benchmark crashed quickly in send/drain handling, so the current best on 0.29.0 also fundamentally depends on the server-side ICE UDP mux path.","timestamp":1773679933367,"segment":5}
{"run":192,"commit":"fb21bda","metric":0,"metrics":{},"status":"crash","description":"perf(webrtc): compare the old and new native stacks under a more apples-to-apples conservative direct-path regime by taking node-datachannel 0.29.0 off its aggressive win path as well—removing explicit ICE TCP, removing mtu=1500, disabling server-side ICE UDP mux, and shrinking the queue shape to the best fair 0.24.x settings (3 MiB send, 2 MiB recv, 2 MiB bufferedAmount cap, 75% resume threshold); this timed out, showing the current 0.29 line also does not remain healthy under that raw-native-like regime.","timestamp":1773680062728,"segment":5}
{"run":193,"commit":"fb21bda","metric":0.3039103877143867,"metrics":{},"status":"discard","description":"diag(webrtc): baseline the current 0.29.0/libdatachannel 0.23.0 aggressive direct path with a raw native event trace before the benchmark; it stayed on one UDP host↔host candidate pair (brief prflx→host stabilization, no TCP-selected pair), opened the data channel at ~1.7s, and delivered the first receive immediately after open, while the primary benchmark rerun landed below the 0.3137 best at 0.3039.","timestamp":1773682312275,"segment":5}
{"run":194,"commit":"fb21bda","metric":0,"metrics":{},"status":"crash","description":"diag(webrtc): switch the aggressive direct-path setup to node-datachannel 0.32.1/libdatachannel 0.24.0; the primary benchmark still failed almost immediately with the same RTCDataChannel send errno=32 path, reinforcing the regression, but the temporary raw diagnostic script missed this run because npm hoisted node-datachannel from the workspace into the repo root, so fix the diagnostic import resolver before the next comparison.","timestamp":1773682368361,"segment":5}
{"run":195,"commit":"fb21bda","metric":0,"metrics":{},"status":"crash","description":"diag(webrtc): compare aggressive node-datachannel 0.32.1/libdatachannel 0.24.0 against the 0.29.0 baseline with a raw native event trace; unlike 0.29.0, the newer stack stays on the same UDP host↔host candidate pair but throws Sending failed errno=32 after ~15.6 MiB of queued sends before either data channel reports open and before any receive, and the libp2p benchmark crashes on the same early-send path.","timestamp":1773682429223,"segment":5}
{"run":196,"commit":"fb21bda","metric":0.2836504329425016,"metrics":{},"status":"discard","description":"diag(webrtc): retest node-datachannel 0.32.1/libdatachannel 0.24.0 in the conservative no-ICE-TCP/no-server-mux/no-MTU regime with 3 MiB/2 MiB native buffers and a 2 MiB/75% JS queue; the raw trace still stayed on one UDP host↔host pair with no TCP-selected path or candidate switch, but unlike the aggressive setup it tolerated the same pre-open queued sends, emitted many send-returned-false backpressure events, opened both data channels at ~2.7s, and delivered the first receive immediately after open, while the benchmark completed at 0.2837.","timestamp":1773682663733,"segment":5}
{"run":197,"commit":"fb21bda","metric":0,"metrics":{},"status":"crash","description":"diag(webrtc): gate node RTCDataChannel streams on the actual open event when node-datachannel reports readyState=\"open\" early, then retest aggressive node-datachannel 0.32.1/libdatachannel 0.24.0; the direct benchmark still crashed with the same Sending failed errno=32 path, so simply suppressing one early-readyState shortcut in WebRTCStream does not make the aggressive 0.24.x regime viable.","timestamp":1773683129944,"segment":5}
{"run":198,"commit":"fb21bda","metric":0,"metrics":{},"status":"crash","description":"diag(webrtc): add env-gated stream open diagnostics on top of the node open-event gate and rerun aggressive node-datachannel 0.32.1/libdatachannel 0.24.0; both negotiated channel-0 streams still reported readyState=open before any observed open event, timed out through the gate, and then hit the send path before an open event with the connection already closed, shifting the failure from errno=32 to DataChannel is closed and strengthening the case that the aggressive 0.24.x path never reaches a trustworthy channel-open state for the direct handshake.","timestamp":1773683238863,"segment":5}
{"run":199,"commit":"fb21bda","metric":0.30184398285783776,"metrics":{},"status":"checks_failed","description":"diag(webrtc): compare the env-gated node open-event stream diagnostics on the current 0.29.0/libdatachannel 0.23.0 stack; unlike aggressive 0.32.1, the current best path also reports handshake channel 0 as readyState=open before any observed open event, but later per-stream channels (1/2/4) do emit open and the benchmark stays healthy at 0.3018. The diagnostic patch breaks the stubbed Max message size test because fake open channels never emit open, so this run is checks_failed and should not be kept.","timestamp":1773683419437,"segment":5}
{"run":200,"commit":"fb21bda","metric":0,"metrics":{},"status":"crash","description":"diag(webrtc): extend the node open-event diagnostics with per-stream first-send markers and rerun aggressive node-datachannel 0.32.1/libdatachannel 0.24.0; handshake channel 0 still only reaches readyState=open without any observed open event, but the first application stream (channel 2) does emit open and reaches its first send with openEventObserved=true before the benchmark still dies with DataChannel is closed. That narrows the aggressive 0.24.x fault further: it is not just pre-open send misuse, because even the first post-open application stream collapses immediately after opening.","timestamp":1773683528272,"segment":5}
{"run":201,"commit":"fb21bda","metric":0,"metrics":{},"status":"crash","description":"diag(webrtc): add channel close/error diagnostics and rerun aggressive node-datachannel 0.32.1/libdatachannel 0.24.0; the first application stream (channel 2) now clearly emits open, reaches its first send, and then both sides receive a close event on channel 2 before the send path throws DataChannel is closed, while handshake channel 0 still never shows an observed open event. The aggressive 0.24.x fault therefore looks like an immediate post-open application-channel teardown, not merely a pre-open queueing bug.","timestamp":1773683589140,"segment":5}
{"run":202,"commit":"fb21bda","metric":0,"metrics":{},"status":"crash","description":"diag(webrtc): test a small 50ms post-open stabilization delay before dispatching stream drain on aggressive node-datachannel 0.32.1/libdatachannel 0.24.0; the first application channel still emitted open, reached its first send, and closed immediately on both sides before send completion, while handshake channel 0 still never showed an observed open event. A simple short post-open delay does not rescue the aggressive 0.24.x teardown.","timestamp":1773683669269,"segment":5}
{"run":203,"commit":"fb21bda","metric":0,"metrics":{},"status":"crash","description":"diag(webrtc): delay outbound application datachannel creation by 100ms before createDataChannel and retest aggressive node-datachannel 0.32.1/libdatachannel 0.24.0; the direct benchmark still failed almost immediately with the original Sending failed errno=32 path, so the newer aggressive teardown is not simply caused by opening the first application channel too soon after the handshake.","timestamp":1773683866055,"segment":5}
{"run":204,"commit":"fb21bda","metric":0,"metrics":{},"status":"crash","description":"diag(webrtc): add env-gated muxer/channel diagnostics and rerun aggressive node-datachannel 0.32.1/libdatachannel 0.24.0; the first application channel (2) is created and opened cleanly on both sides over a UDP host/prflx path, but then the whole peer connection transitions straight to closed before the channel closes and the send path throws DataChannel is closed. This points upstream from stream buffering: the aggressive 0.24.x failure is a full peer-connection teardown triggered immediately after opening the first application data channel.","timestamp":1773684066274,"segment":5}
