{"run":69,"commit":"b942f54","metric":0.2936135876768492,"metrics":{},"status":"discard","description":"bench: rerun the current best mtu=1500 + 7 MiB/4 MiB configuration again to gauge drift after the latest native-path probes; this rerun landed at 0.2936, confirming the benchmark still has enough noise that single-run improvements near the current frontier need skepticism.","timestamp":1773658642767,"segment":0}
{"type":"config","name":"WebRTC-direct anchored TCP ratio with 5 throughput iterations","metricName":"webrtc_direct_tcp_ratio","metricUnit":"","bestDirection":"higher"}
{"run":1,"commit":"0e1104b","metric":0.2982600904668272,"metrics":{},"status":"keep","description":"bench(webrtc): increase the direct-only throughput workload from 3 to 5 iterations to reduce frontier noise in the anchored-TCP inner loop; baseline the current best mtu=1500 + 7 MiB/4 MiB configuration at webrtc_direct_tcp_ratio 0.2983 under the heavier benchmark.","timestamp":1773658879507,"segment":0}
{"run":2,"commit":"0e1104b","metric":0.29057440005152324,"metrics":{},"status":"discard","description":"perf(webrtc): under the new 5-iteration direct benchmark, retry the most promising deeper native congestion-control probe by setting node-datachannel congestionControlModule=1 on top of mtu=1500 + 7 MiB/4 MiB buffers; the heavier workload regressed to 0.2906, so it still does not beat the baseline.","timestamp":1773659065034,"segment":0}
{"run":3,"commit":"0e1104b","metric":0.29785663872628965,"metrics":{},"status":"discard","description":"perf(webrtc): under the new 5-iteration direct benchmark, retry explicitly enabling ICE TCP alongside mtu=1500 + 7 MiB/4 MiB buffers; the heavier workload nearly matched baseline at 0.2979 but still fell short of 0.2983.","timestamp":1773659256927,"segment":0}
{"run":4,"commit":"49bb7a8","metric":0.3037473090709871,"metrics":{},"status":"keep","description":"perf(webrtc): under the new 5-iteration direct benchmark, combine the two least-bad deeper native probes by setting congestionControlModule=1 and explicitly enabling ICE TCP alongside mtu=1500 + 7 MiB/4 MiB buffers; the heavier workload improved from the 0.2983 baseline to 0.3037.","timestamp":1773659500276,"segment":0}
{"run":5,"commit":"49bb7a8","metric":0.2991126385073026,"metrics":{},"status":"discard","description":"bench: rerun the new 5-iteration best native combo (congestionControlModule=1 + enableIceTcp=true with mtu=1500 + 7 MiB/4 MiB buffers) to gauge stability; the rerun fell back to 0.2991, so the improvement may be real but remains close enough to the noise floor that it still needs skepticism.","timestamp":1773659680548,"segment":0}
{"run":6,"commit":"49bb7a8","metric":0.30285570609314083,"metrics":{},"status":"discard","description":"perf(webrtc): under the 5-iteration benchmark, retune the new native best by raising SCTP sendBufferSize from 7 MiB to 8 MiB while keeping congestionControlModule=1, enableIceTcp=true, recvBufferSize=4 MiB, and mtu=1500; upload improved but overall ratio still slipped slightly from 0.3037 to 0.3029.","timestamp":1773659917583,"segment":0}
{"run":7,"commit":"2bb5cb2","metric":0.30765922053534034,"metrics":{},"status":"keep","description":"perf(webrtc): under the 5-iteration benchmark, retune the new native best by lowering SCTP sendBufferSize from 7 MiB to 6 MiB while keeping congestionControlModule=1, enableIceTcp=true, recvBufferSize=4 MiB, and mtu=1500; ratio improved from 0.3037 to 0.3077, driven by much faster download throughput.","timestamp":1773660097331,"segment":0}
{"run":8,"commit":"2bb5cb2","metric":0.29598884596628666,"metrics":{},"status":"discard","description":"perf(webrtc): continue retuning the 5-iteration native best by lowering SCTP sendBufferSize further from 6 MiB to 5 MiB while keeping congestionControlModule=1, enableIceTcp=true, recvBufferSize=4 MiB, and mtu=1500; ratio regressed sharply to 0.2960.","timestamp":1773660275824,"segment":0}
{"run":9,"commit":"2bb5cb2","metric":0,"metrics":{},"status":"crash","description":"perf(webrtc): with the 5-iteration native best (6 MiB send, congestionControlModule=1, enableIceTcp=true, mtu=1500), raise SCTP recvBufferSize from 4 MiB to 5 MiB; the transfer became unstable and crashed after receiving only 354582514/536870912 bytes.","timestamp":1773660428175,"segment":0}
{"run":10,"commit":"2bb5cb2","metric":0.30527996229178417,"metrics":{},"status":"discard","description":"perf(webrtc): probe whether the new 5-iteration native best has a smoother local optimum between 6 MiB and 7 MiB by setting SCTP sendBufferSize to 6.5 MiB while keeping congestionControlModule=1, enableIceTcp=true, recvBufferSize=4 MiB, and mtu=1500; ratio improved over the 7 MiB setting but still trailed the 6 MiB best at 0.3053 vs 0.3077.","timestamp":1773660623970,"segment":0}
{"run":11,"commit":"c8ec2d5","metric":0.3089027725170676,"metrics":{},"status":"keep","description":"bench: rerun the current 5-iteration native best (6 MiB send, 4 MiB recv, congestionControlModule=1, enableIceTcp=true, mtu=1500) to gauge stability; instead of regressing it improved further to 0.3089, increasing confidence that this heavier-workload configuration is a real step up over the 0.2983 baseline.","timestamp":1773660806414,"segment":0}
{"run":12,"commit":"c8ec2d5","metric":0.3007544407838022,"metrics":{},"status":"discard","description":"perf(webrtc): with the new 5-iteration native best in place, probe whether the local send-buffer optimum sits between 5 MiB and 6 MiB by setting SCTP sendBufferSize to 5.5 MiB while keeping 4 MiB recv, congestionControlModule=1, enableIceTcp=true, and mtu=1500; ratio regressed to 0.3008.","timestamp":1773660993346,"segment":0}
{"run":13,"commit":"c8ec2d5","metric":0.30059755535032157,"metrics":{},"status":"discard","description":"perf(webrtc): under the 5-iteration native best, probe whether the SCTP receive-buffer optimum sits slightly below 4 MiB by lowering recvBufferSize to 3.5 MiB while keeping 6 MiB send, congestionControlModule=1, enableIceTcp=true, and mtu=1500; ratio regressed to 0.3006.","timestamp":1773661238795,"segment":0}
{"run":14,"commit":"c8ec2d5","metric":0.29982864111463314,"metrics":{},"status":"discard","description":"perf(webrtc): under the 5-iteration native best, probe whether the SCTP receive-buffer optimum sits slightly above 4 MiB by raising recvBufferSize to 4.5 MiB while keeping 6 MiB send, congestionControlModule=1, enableIceTcp=true, and mtu=1500; ratio regressed to 0.2998.","timestamp":1773661435424,"segment":0}
{"run":15,"commit":"c8ec2d5","metric":0.29265001884657726,"metrics":{},"status":"discard","description":"perf(webrtc): isolate the current 5-iteration native best by removing explicit enableIceTcp=true while keeping the newer 6 MiB send buffer, 4 MiB recv buffer, congestionControlModule=1, and mtu=1500; ratio dropped to 0.2927, showing that the new best really depends on the ICE TCP enablement too.","timestamp":1773661634914,"segment":0}
{"run":16,"commit":"c8ec2d5","metric":0.2884510640652827,"metrics":{},"status":"discard","description":"perf(webrtc): under the newer 5-iteration native best, test whether congestionControlModule=2 stacks better with the 6 MiB send buffer and explicit enableIceTcp=true than it did under the older tuning; ratio regressed sharply to 0.2885.","timestamp":1773661832170,"segment":0}
{"run":17,"commit":"c8ec2d5","metric":0.2966477721114801,"metrics":{},"status":"discard","description":"perf(webrtc): retest the shared write high-water mark under the newer 5-iteration native best by lowering MAX_BUFFERED_AMOUNT from 6 MiB to 5 MiB while keeping the 6 MiB send buffer, 4 MiB recv buffer, congestionControlModule=1, enableIceTcp=true, and mtu=1500; ratio regressed to 0.2966.","timestamp":1773662034329,"segment":0}
{"run":18,"commit":"c8ec2d5","metric":0.302952704374564,"metrics":{},"status":"discard","description":"bench: rerun the current 5-iteration native best (6 MiB send, 4 MiB recv, congestionControlModule=1, enableIceTcp=true, mtu=1500) again to gauge stability; the result remained above the 0.2983 baseline at 0.3030 but still below the current 0.3089 best, confirming a real improvement with residual noise still present.","timestamp":1773662215678,"segment":0}
{"run":19,"commit":"c8947a2","metric":0.3123450078410773,"metrics":{},"status":"keep","description":"perf(webrtc): with the current 5-iteration native best (6 MiB send, 4 MiB recv, congestionControlModule=1, enableIceTcp=true, mtu=1500), retest the shared write resume threshold by raising bufferedAmountLowThreshold from 75% to 80% of MAX_BUFFERED_AMOUNT; under the heavier workload this improved ratio from 0.3089 to 0.3123 with faster upload and download throughput.","timestamp":1773662397081,"segment":0}
{"run":20,"commit":"c8947a2","metric":0.30965439685803287,"metrics":{},"status":"discard","description":"perf(webrtc): continue retuning the shared write resume threshold under the new 5-iteration best by raising bufferedAmountLowThreshold from 80% to 85% of MAX_BUFFERED_AMOUNT; throughput stayed strong but the overall ratio regressed from 0.3123 to 0.3097.","timestamp":1773662582563,"segment":0}
{"run":21,"commit":"c8947a2","metric":0.3060105107736444,"metrics":{},"status":"discard","description":"perf(webrtc): probe whether the new 5-iteration best has a smoother local send-buffer optimum just above 6 MiB by setting SCTP sendBufferSize to 6.25 MiB while keeping 4 MiB recv, congestionControlModule=1, enableIceTcp=true, mtu=1500, and the new 80% resume threshold; ratio regressed to 0.3060.","timestamp":1773662773257,"segment":0}
{"run":22,"commit":"c8947a2","metric":0.2971098538836401,"metrics":{},"status":"discard","description":"perf(webrtc): retest the shared write high-water mark under the new 5-iteration best and the stronger 80% resume threshold by raising MAX_BUFFERED_AMOUNT from 6 MiB to 6.5 MiB; ratio regressed sharply to 0.2971, so the 6 MiB queue still looks better.","timestamp":1773662969822,"segment":0}
{"run":23,"commit":"c8947a2","metric":0.30162673520196165,"metrics":{},"status":"discard","description":"perf(webrtc): with the stronger 80% resume threshold now in place, retest whether the native send-buffer optimum shifts back up by raising SCTP sendBufferSize from 6 MiB to 7 MiB while keeping 4 MiB recv, congestionControlModule=1, enableIceTcp=true, and mtu=1500; ratio still regressed to 0.3016.","timestamp":1773663154969,"segment":0}
{"run":24,"commit":"fb21bda","metric":0.313742533089552,"metrics":{},"status":"keep","description":"perf(webrtc): continue retuning the shared write resume threshold under the new 5-iteration native best by nudging bufferedAmountLowThreshold from 80% to 82% of MAX_BUFFERED_AMOUNT; ratio improved again from 0.3123 to 0.3137 with very strong upload and download throughput.","timestamp":1773663343158,"segment":0}
{"run":25,"commit":"fb21bda","metric":0.30298615532413914,"metrics":{},"status":"discard","description":"perf(webrtc): continue retuning the shared write resume threshold under the new 5-iteration best by nudging bufferedAmountLowThreshold from 82% to 83% of MAX_BUFFERED_AMOUNT; ratio regressed sharply to 0.3030, so the sweet spot appears to be very near 82%.","timestamp":1773663518436,"segment":0}
{"run":26,"commit":"fb21bda","metric":0.3109564896256683,"metrics":{},"status":"discard","description":"perf(webrtc): map the stronger shared write resume region around the new 82% best by lowering bufferedAmountLowThreshold slightly to 81% of MAX_BUFFERED_AMOUNT; throughput stayed high but ratio still trailed the 82% setting at 0.3110 vs 0.3137.","timestamp":1773663707165,"segment":0}
{"run":27,"commit":"fb21bda","metric":0.3027049845729163,"metrics":{},"status":"discard","description":"perf(webrtc): retest the local send-buffer shoulder under the newer 82% resume threshold by raising SCTP sendBufferSize from 6 MiB to 6.25 MiB while keeping 4 MiB recv, congestionControlModule=1, enableIceTcp=true, and mtu=1500; ratio still regressed to 0.3027.","timestamp":1773663912876,"segment":0}
{"run":28,"commit":"fb21bda","metric":0,"metrics":{},"status":"crash","description":"perf(webrtc): test whether the new 5-iteration native best benefits from disabling ICE UDP mux entirely while keeping enableIceTcp=true, congestionControlModule=1, 6 MiB send, 4 MiB recv, mtu=1500, and the 82% resume threshold; connection setup/stream lifecycle became unstable and the benchmark crashed.","timestamp":1773664016532,"segment":0}
{"run":29,"commit":"fb21bda","metric":0.30732707155001954,"metrics":{},"status":"discard","description":"bench: rerun the current 5-iteration best (6 MiB send, 4 MiB recv, congestionControlModule=1, enableIceTcp=true, mtu=1500, 82% resume threshold) to gauge stability after the latest crashy native-path probe; the result stayed above the 0.2983 baseline at 0.3073 but remained below the 0.3137 best.","timestamp":1773664216887,"segment":0}
{"run":30,"commit":"fb21bda","metric":0,"metrics":{},"status":"crash","description":"perf(webrtc): test whether the new 5-iteration native best benefits from enabling ICE UDP mux on both node-datachannel peers instead of only the server; connection setup timed out quickly, so this remains unstable under the newer best as well.","timestamp":1773664333454,"segment":0}
{"run":31,"commit":"fb21bda","metric":0.30402657005118905,"metrics":{},"status":"discard","description":"perf(webrtc): retest forceMediaTransport=true under the newer 5-iteration native best (6 MiB send, 4 MiB recv, congestionControlModule=1, enableIceTcp=true, mtu=1500, 82% resume threshold); ratio improved over older forceMediaTransport probes but still trailed the current best at 0.3040 vs 0.3137.","timestamp":1773664523182,"segment":0}
{"run":32,"commit":"fb21bda","metric":0.30153033009917707,"metrics":{},"status":"discard","description":"perf(webrtc): test whether the new 5-iteration best benefits from binding node-datachannel explicitly to 127.0.0.1 while keeping enableIceTcp=true, congestionControlModule=1, 6 MiB send, 4 MiB recv, mtu=1500, and the 82% resume threshold; ratio regressed to 0.3015.","timestamp":1773664777038,"segment":0}
{"run":33,"commit":"fb21bda","metric":0,"metrics":{},"status":"crash","description":"perf(webrtc): isolate how much of the new 5-iteration best still depends on the native mtu override by removing mtu=1500 while keeping enableIceTcp=true, congestionControlModule=1, 6 MiB send, 4 MiB recv, and the 82% resume threshold; the transfer became unstable and crashed after receiving only 329760747/536870912 bytes.","timestamp":1773664996074,"segment":0}
{"run":34,"commit":"fb21bda","metric":0.3040508065040516,"metrics":{},"status":"discard","description":"perf(webrtc): try trimming receive-path allocation overhead in the shared stream path by passing decoded protobuf payload Uint8Arrays directly to onData instead of wrapping each one in a new Uint8ArrayList; under the 5-iteration best this regressed to 0.3041, so the existing receive handoff remains better here.","timestamp":1773665399302,"segment":0}
{"run":35,"commit":"fb21bda","metric":0.3116124482005456,"metrics":{},"status":"discard","description":"perf(webrtc): trim one event/callback hop from the shared send path by resuming the write queue directly inside RTCDataChannel.onbufferedamountlow before still emitting the drain event for waiters; this stayed strong at 0.3116 with lower latency, but still trailed the 0.3137 best.","timestamp":1773665607275,"segment":0}
{"run":36,"commit":"fb21bda","metric":0,"metrics":{},"status":"crash","description":"perf(webrtc): reduce hot-loop polling of RTCDataChannel.bufferedAmount in the shared send path by keeping an estimated buffered byte count, incrementing it on each send, and only resynchronizing on bufferedamountlow; this destabilized the transfer and timed out, so the approximation is not yet safe enough.","timestamp":1773665815779,"segment":0}
{"run":37,"commit":"fb21bda","metric":0.28224531839665185,"metrics":{},"status":"discard","description":"perf(webrtc): probe whether backing slightly away from the 16 KiB interoperability ceiling helps the shared browser/node data path by reducing MAX_MESSAGE_SIZE from 16 KiB to 15 KiB under the current 5-iteration best; this regressed sharply to 0.2822.","timestamp":1773666034043,"segment":0}
{"run":38,"commit":"fb21bda","metric":0.3026167677047358,"metrics":{},"status":"discard","description":"bench: rerun the current 5-iteration best (6 MiB send, 4 MiB recv, congestionControlModule=1, enableIceTcp=true, mtu=1500, 82% resume threshold) again to gauge frontier noise; it remained above the 0.2983 baseline but landed at 0.3026, reinforcing that reruns near the frontier still swing materially.","timestamp":1773666234423,"segment":0}
{"run":39,"commit":"fb21bda","metric":0.30011788011907964,"metrics":{},"status":"discard","description":"perf(webrtc): try a more conservative shared send-path reduction in bufferedAmount polling by keeping a sampled estimate, resynchronizing from the real channel state every few sends and on bufferedamountlow; this remained stable but still regressed to 0.3001.","timestamp":1773666516954,"segment":0}
{"run":40,"commit":"fb21bda","metric":0,"metrics":{},"status":"crash","description":"perf(webrtc): try removing one microtask indirection from the shared receive path by starting the length-prefixed decoder loop immediately with an async IIFE instead of Promise.resolve().then(...); this failed at build time because TypeScript treated incomingData as used before assignment.","timestamp":1773666764466,"segment":0}
{"run":41,"commit":"fb21bda","metric":0.3051494090218989,"metrics":{},"status":"discard","description":"perf(webrtc): retry removing one microtask hop from the shared receive path by starting the length-prefixed decoder loop with an immediate async IIFE after capturing incomingData locally to satisfy TypeScript; the benchmark stayed stable but still regressed to 0.3051.","timestamp":1773666958501,"segment":0}
{"run":42,"commit":"fb21bda","metric":0.3052759511884521,"metrics":{},"status":"discard","description":"perf(webrtc): try a tracked node-only direct RTCDataChannel wrapper for the WebRTC-direct path so property callbacks are invoked without the extra node-datachannel polyfill EventTarget trampoline on both outbound and inbound channels; the wrapper stayed correct but still regressed to 0.3053 under the 5-iteration benchmark.","timestamp":1773667535635,"segment":0}
{"run":43,"commit":"fb21bda","metric":0.29250485122344494,"metrics":{},"status":"discard","description":"perf(webrtc): probe whether a slightly less extreme near-path-MTU setting can preserve the current native-heavy win without relying on the exact 1500-byte override by lowering node-datachannel PeerConnection mtu from 1500 to 1472 while keeping enableIceTcp=true, congestionControlModule=1, 6 MiB send, 4 MiB recv, and the 82% resume threshold; ratio regressed materially to 0.2925.","timestamp":1773667902409,"segment":0}
{"run":44,"commit":"fb21bda","metric":0.2993023167413732,"metrics":{},"status":"discard","description":"perf(webrtc): revisit a deeper usrsctp ACK-timing knob under the current 5-iteration best by adding delayedSackTime=10ms alongside sendBufferSize=6 MiB, recvBufferSize=4 MiB, congestionControlModule=1, enableIceTcp=true, mtu=1500, and the 82% resume threshold; the run stayed stable but regressed to 0.2993.","timestamp":1773668092805,"segment":0}
{"run":45,"commit":"fb21bda","metric":0.2939553854482597,"metrics":{},"status":"discard","description":"bench: rerun the current 5-iteration best (6 MiB send, 4 MiB recv, congestionControlModule=1, enableIceTcp=true, mtu=1500, 82% resume threshold) after the latest near-MTU and SCTP tuning dead ends to gauge drift; this run fell to 0.2940, reinforcing that frontier noise is still large enough that single-run regressions and improvements need caution.","timestamp":1773668320785,"segment":0}
{"run":46,"commit":"fb21bda","metric":0.3051906414489005,"metrics":{},"status":"discard","description":"perf(webrtc): remove the per-message send-path trace call from WebRTCStream._sendMessage so large transfers avoid formatting/log-call overhead on every RTCDataChannel.send; the shared-path change stayed stable but still regressed to 0.3052 under the 5-iteration benchmark.","timestamp":1773668557399,"segment":0}
{"run":47,"commit":"fb21bda","metric":0,"metrics":{},"status":"crash","description":"perf(webrtc): upgrade the actual underlying npm package from node-datachannel 0.29.0 (libdatachannel 0.23.0, libjuice default) to node-datachannel 0.32.1 (libdatachannel 0.24.0) to test whether a newer native WebRTC stack closes more of the TCP gap; the benchmark failed almost immediately with libdatachannel send errors (errno=32), so the straight package swap is not drop-in safe here.","timestamp":1773672310956,"segment":0}
{"run":48,"commit":"fb21bda","metric":0.29776155607331595,"metrics":{},"status":"discard","description":"perf(webrtc): continue underlying-package exploration by upgrading from node-datachannel 0.29.0 to 0.30.0 (still libdatachannel 0.23.0) and relaxing several now-unused @ts-expect-error annotations to @ts-ignore so the newer package types build; the straight package swap became benchmarkable but still regressed to 0.2978 under the current 5-iteration best.","timestamp":1773672723110,"segment":0}
{"run":49,"commit":"fb21bda","metric":0,"metrics":{},"status":"crash","description":"perf(webrtc): continue underlying-package version sweeps by upgrading to node-datachannel 0.31.0 (libdatachannel 0.24.0); unlike 0.30.0, this version is not even source-compatible with the current transport typings because its newer private RTCDataChannelEvent/RTCPeerConnection types trigger hard TypeScript assignability failures across the muxer and connection setup paths.","timestamp":1773672835931,"segment":0}
