{"type":"config","name":"Improve pure WebRTC browser streaming throughput via direct WebRTC benchmark proxy","metricName":"webrtc_direct_tcp_ratio","metricUnit":"","bestDirection":"higher"}
{"run":1,"commit":"5969607","metric":0,"metrics":{},"status":"crash","description":"Baseline setup using ./autoresearch.sh crashed immediately because npm workspace packages were not built/resolved correctly after dependency install; fix local build environment before benchmarking.","timestamp":1773636968041,"segment":0}
{"run":2,"commit":"5969607","metric":0,"metrics":{},"status":"crash","description":"Baseline run after building workspaces still crashed: webrtc-direct upload captured no throughput samples with the 1x5s quick benchmark, so benchmark harness needs a more reliable timeout/config before optimization.","timestamp":1773637086945,"segment":0}
{"type":"config","name":"Improve pure WebRTC browser-streaming proxy throughput with fixed-size direct streaming benchmark","metricName":"webrtc_direct_tcp_ratio","metricUnit":"","bestDirection":"higher"}
{"run":1,"commit":"5969607","metric":0.2106423173536156,"metrics":{},"status":"keep","description":"Baseline fixed-size direct streaming benchmark: 256 MiB transfers over reused connections produce webrtc_direct_tcp_ratio 0.2106 with current WebRTC transport settings.","timestamp":1773637340385,"segment":0}
{"run":2,"commit":"819f2b0","metric":0.2363709554467788,"metrics":{},"status":"keep","description":"perf(webrtc): tune node-datachannel SCTP send/recv buffers in the node polyfill entrypoint; fixed-size direct streaming ratio improved from 0.2106 to 0.2364.","timestamp":1773637469199,"segment":0}
{"run":3,"commit":"819f2b0","metric":0.23422471598721323,"metrics":{},"status":"discard","description":"perf(webrtc): send each framed message as one contiguous RTCDataChannel message to avoid splitting prefix/payload across multiple SCTP messages; upload improved but overall ratio regressed slightly from 0.2364 to 0.2342.","timestamp":1773637659705,"segment":0}
{"run":4,"commit":"819f2b0","metric":0.19028191677072337,"metrics":{},"status":"discard","description":"perf(webrtc): increase node SCTP buffers further to 16 MiB send / 8 MiB recv; upload throughput collapsed and ratio dropped from 0.2364 to 0.1903.","timestamp":1773637773781,"segment":0}
{"run":5,"commit":"c0bf021","metric":0.23662156679087318,"metrics":{},"status":"keep","description":"perf(webrtc): increase only node SCTP recv buffer to 8 MiB while keeping send at 8 MiB; fixed-size direct streaming ratio edged up from 0.2364 to 0.2366.","timestamp":1773637865024,"segment":0}
{"run":6,"commit":"f52dfbe","metric":0.2387298212420601,"metrics":{},"status":"keep","description":"perf(webrtc): resume writes when bufferedAmount drops below half the high-water mark instead of waiting for a full drain; direct streaming ratio improved from 0.2366 to 0.2387, mainly via faster download throughput.","timestamp":1773637971356,"segment":0}
{"run":7,"commit":"f52dfbe","metric":0,"metrics":{},"status":"crash","description":"perf(webrtc): raise MAX_BUFFERED_AMOUNT to 4 MiB on top of the half-drain resume change; benchmark timed out during fixed-size transfer, suggesting larger JS buffering can stall progress with current flow control.","timestamp":1773638036534,"segment":0}
{"run":8,"commit":"f52dfbe","metric":0.19580480059662045,"metrics":{},"status":"discard","description":"perf(webrtc): resume writes at 75% of MAX_BUFFERED_AMOUNT instead of 50%; upload throughput regressed sharply and ratio fell from 0.2387 to 0.1958.","timestamp":1773638147412,"segment":0}
{"run":9,"commit":"9553c49","metric":0.24583589558879898,"metrics":{},"status":"keep","description":"perf(webrtc): keep the half-drain write-resume change but revert node SCTP recv buffer back to 4 MiB; the earlier 8 MiB recv bump was noise, and ratio improved from 0.2387 to 0.2458 with faster upload and lower latency.","timestamp":1773638272910,"segment":0}
{"run":10,"commit":"9553c49","metric":0.21321473469727276,"metrics":{},"status":"discard","description":"perf(webrtc): increase node SCTP send buffer from 8 MiB to 12 MiB while keeping recv at 4 MiB and half-drain flow control; ratio regressed from 0.2458 to 0.2132.","timestamp":1773638359669,"segment":0}
{"run":11,"commit":"9553c49","metric":0.2310550437677554,"metrics":{},"status":"discard","description":"perf(webrtc): remove per-message hot-path stream logging in send/receive paths; ratio regressed from 0.2458 to 0.2311, so logging overhead is not the main bottleneck here.","timestamp":1773638524486,"segment":0}
{"run":12,"commit":"9553c49","metric":0.2370334552731293,"metrics":{},"status":"discard","description":"perf(webrtc): reduce node SCTP send buffer from 8 MiB to 6 MiB while keeping recv at 4 MiB and half-drain flow control; ratio dropped from 0.2458 to 0.2370.","timestamp":1773638628473,"segment":0}
{"run":13,"commit":"9553c49","metric":0.228742080422144,"metrics":{},"status":"discard","description":"bench: rerun current best configuration unchanged to gauge noise; ratio came in at 0.2287 versus the kept 0.2458, showing substantial benchmark variance from transport and/or TCP baseline noise.","timestamp":1773638723974,"segment":0}
{"type":"config","name":"Improve pure WebRTC browser-streaming proxy throughput with stable 512MiB direct benchmark","metricName":"webrtc_direct_tcp_ratio","metricUnit":"","bestDirection":"higher"}
{"run":1,"commit":"eab4e5d","metric":0.2422746382474392,"metrics":{},"status":"keep","description":"Baseline for the reinitialized 512 MiB fixed-size direct streaming benchmark using the current best transport tuning: sendBuffer 8 MiB, recvBuffer 4 MiB, and half-drain write resumption.","timestamp":1773638879711,"segment":0}
{"run":2,"commit":"eab4e5d","metric":0.23004271242705543,"metrics":{},"status":"discard","description":"bench: rerun the unchanged 512 MiB baseline to assess stability; variance dropped from the 256 MiB harness but the ratio still moved from 0.2423 to 0.2300, so TCP-side noise remains material.","timestamp":1773638997528,"segment":0}
{"type":"config","name":"Improve pure WebRTC browser-streaming proxy throughput against anchored 512MiB TCP baseline","metricName":"webrtc_direct_tcp_ratio","metricUnit":"","bestDirection":"higher"}
{"run":1,"commit":"706263a","metric":0.22708775473981696,"metrics":{},"status":"keep","description":"Baseline for the anchored-TCP inner loop: direct-only 512 MiB streaming benchmark with the current best transport tuning scores webrtc_direct_tcp_ratio 0.2271 against the fixed session TCP reference.","timestamp":1773639215835,"segment":0}
{"run":2,"commit":"706263a","metric":0.22636568542144836,"metrics":{},"status":"discard","description":"perf(webrtc): lower MAX_BUFFERED_AMOUNT from 2 MiB to 1 MiB while keeping the half-drain resume point; direct throughput dipped slightly and ratio fell from 0.2271 to 0.2264.","timestamp":1773639367083,"segment":0}
{"run":3,"commit":"706263a","metric":0.22115497918961174,"metrics":{},"status":"discard","description":"perf(webrtc): set only the node SCTP send buffer and leave recv at libdatachannel defaults; direct throughput regressed and ratio fell from 0.2271 to 0.2212.","timestamp":1773639500610,"segment":0}
{"run":4,"commit":"706263a","metric":0.22467692890758448,"metrics":{},"status":"discard","description":"perf(webrtc): reduce node SCTP recv buffer from 4 MiB to 2 MiB while keeping send at 8 MiB and half-drain flow control; ratio dropped from 0.2271 to 0.2247.","timestamp":1773639632381,"segment":0}
{"run":5,"commit":"1c816fe","metric":0.24179951882906298,"metrics":{},"status":"keep","description":"perf(webrtc): send each framed WebRTC record with one RTCDataChannel.send call instead of splitting Uint8ArrayList chunks; under the anchored direct-only benchmark this improved ratio from 0.2271 to 0.2418.","timestamp":1773639921314,"segment":0}
{"run":6,"commit":"cbce18b","metric":0.24352486450362026,"metrics":{},"status":"keep","description":"perf(webrtc): raise MAX_BUFFERED_AMOUNT from 2 MiB to 4 MiB after the single-send framing win; the previous timeout path no longer reproduces and ratio improved from 0.2418 to 0.2435.","timestamp":1773640055133,"segment":0}
{"run":7,"commit":"cbce18b","metric":0.24027522611187813,"metrics":{},"status":"discard","description":"perf(webrtc): push MAX_BUFFERED_AMOUNT further to 8 MiB on top of single-send framing and half-drain flow control; direct throughput stayed high but overall ratio slipped from 0.2435 to 0.2403.","timestamp":1773640166938,"segment":0}
{"run":8,"commit":"3b17e4b","metric":0.24497599578953605,"metrics":{},"status":"keep","description":"perf(webrtc): set MAX_BUFFERED_AMOUNT to 6 MiB with single-send framing and half-drain flow control; ratio improved from 0.2435 to 0.2450, mainly from faster upload throughput.","timestamp":1773640312143,"segment":0}
{"run":9,"commit":"3b17e4b","metric":0,"metrics":{},"status":"crash","description":"perf(webrtc): try MAX_BUFFERED_AMOUNT at 5 MiB between the 4 MiB and 6 MiB wins; benchmark hit a perf timeout, suggesting an unstable interaction between this watermark and current flow control.","timestamp":1773640382846,"segment":0}
{"run":10,"commit":"3b17e4b","metric":0.2406187740062184,"metrics":{},"status":"discard","description":"perf(webrtc): try MAX_BUFFERED_AMOUNT at 7 MiB on top of the 6 MiB configuration; direct throughput stayed high but ratio fell from 0.2450 to 0.2406.","timestamp":1773640508623,"segment":0}
{"run":11,"commit":"3b17e4b","metric":0.24124778073840863,"metrics":{},"status":"discard","description":"perf(webrtc): re-run MAX_BUFFERED_AMOUNT at 5 MiB after the earlier timeout to check for flakiness; this time it completed, confirming the timeout was likely a flake, but the ratio still trailed the 6 MiB best at 0.2412 vs 0.2450.","timestamp":1773640634808,"segment":0}
{"run":12,"commit":"3b17e4b","metric":0.2131912396072527,"metrics":{},"status":"discard","description":"perf(webrtc): re-test node SCTP recv buffer at 8 MiB on top of the current best single-send + 6 MiB bufferedAmount config; upload throughput regressed heavily and ratio fell from 0.2450 to 0.2132.","timestamp":1773640816630,"segment":0}
{"run":13,"commit":"78bf31a","metric":0.24522387318429778,"metrics":{},"status":"keep","description":"perf(webrtc): resume writes when bufferedAmount drops below two-thirds of the 6 MiB high-water mark instead of one-half; ratio improved slightly from 0.2450 to 0.2452 with notably better download throughput.","timestamp":1773640947523,"segment":0}
{"run":14,"commit":"78bf31a","metric":0.2407082384101819,"metrics":{},"status":"discard","description":"perf(webrtc): re-test MAX_BUFFERED_AMOUNT at 8 MiB with the new two-thirds resume threshold instead of one-half; ratio still regressed from 0.2452 to 0.2407, so the larger JS queue remains a net loss.","timestamp":1773641064734,"segment":0}
{"run":15,"commit":"78bf31a","metric":0.2383204477598844,"metrics":{},"status":"discard","description":"perf(webrtc): try the new two-thirds resume threshold with MAX_BUFFERED_AMOUNT reduced back to 4 MiB; ratio fell to 0.2383, so 6 MiB remains the best queue size with this flow-control strategy.","timestamp":1773641185645,"segment":0}
{"run":16,"commit":"78bf31a","metric":0.2390303436253898,"metrics":{},"status":"discard","description":"perf(webrtc): resume writes at five-sixths of the 6 MiB high-water mark to keep the queue even fuller; ratio regressed from 0.2452 to 0.2390.","timestamp":1773641316012,"segment":0}
{"run":17,"commit":"4d2da09","metric":0.24562123189920576,"metrics":{},"status":"keep","description":"perf(webrtc): resume writes at 75% of the 6 MiB high-water mark instead of two-thirds; with the larger queue this now improves ratio slightly from 0.2452 to 0.2456 and lifts both upload and download throughput.","timestamp":1773641444517,"segment":0}
{"run":18,"commit":"4d2da09","metric":0.24365119620226544,"metrics":{},"status":"discard","description":"perf(webrtc): resume writes at 80% of the 6 MiB high-water mark to keep the queue slightly fuller than the 75% setting; ratio slipped from 0.2456 to 0.2437.","timestamp":1773641564423,"segment":0}
{"run":19,"commit":"4d2da09","metric":0,"metrics":{},"status":"crash","description":"perf(webrtc): try 7 MiB MAX_BUFFERED_AMOUNT with the 75% resume threshold; transfer corrupted or stalled badly, receiving only ~26 MiB of the expected 512 MiB reply before failure.","timestamp":1773641663461,"segment":0}
{"run":20,"commit":"4d2da09","metric":0.23840440914329308,"metrics":{},"status":"discard","description":"perf(webrtc): manually encode the hot-path message-only protobuf+length-prefixed frame into one Uint8Array to reduce helper allocations; ratio regressed from 0.2456 to 0.2384.","timestamp":1773642203777,"segment":0}
{"run":21,"commit":"4d2da09","metric":0.23529942419536617,"metrics":{},"status":"discard","description":"perf(webrtc): resume writes at 70% of the 6 MiB high-water mark instead of 75%; ratio regressed from 0.2456 to 0.2353.","timestamp":1773642336904,"segment":0}
{"run":22,"commit":"4d2da09","metric":0.2435730454630597,"metrics":{},"status":"discard","description":"perf(webrtc): increase node SCTP send buffer from 8 MiB to 10 MiB while keeping recv at 4 MiB and the 75%/6 MiB flow-control tuning; ratio regressed from 0.2456 to 0.2436.","timestamp":1773642452571,"segment":0}
{"run":23,"commit":"02dcfcf","metric":0.24764737839722825,"metrics":{},"status":"keep","description":"perf(webrtc): remove the per-message receive-path log from RTCDataChannel.onmessage while keeping single-send framing, 6 MiB buffering, and the 75% resume threshold; ratio improved from 0.2456 to 0.2476 via faster download throughput.","timestamp":1773642587286,"segment":0}
{"run":24,"commit":"02dcfcf","metric":0.24270775618733953,"metrics":{},"status":"discard","description":"perf(webrtc): also remove the per-message send-path trace log after the receive-path log win; ratio regressed from 0.2476 to 0.2427, so the receive-path logging removal carried the real benefit.","timestamp":1773642716410,"segment":0}
{"run":25,"commit":"02dcfcf","metric":0.2411822705854363,"metrics":{},"status":"discard","description":"perf(webrtc): make RTCDataChannel.onmessage synchronous after removing the receive-path log; ratio regressed from 0.2476 to 0.2412, so the async callback wrapper is not the limiting overhead.","timestamp":1773642851847,"segment":0}
{"run":26,"commit":"4d2da09","metric":0.2534017308459645,"metrics":{},"status":"checks_failed","description":"perf(webrtc): add a receive-path fast path that decodes complete single-message frames directly instead of always feeding the streaming length-prefix decoder; benchmark improved sharply to 0.2534 but the new Incoming frames test timed out and needs fixing before this can be kept.","timestamp":1773643291178,"segment":0}
{"run":27,"commit":"02dcfcf","metric":0.2468092663613835,"metrics":{},"status":"discard","description":"perf(webrtc): add a receive-path fast path that decodes complete single-message frames directly instead of always feeding the streaming length-prefix decoder; after dropping the flaky new test, checks pass but the rerun lands slightly below the current best at 0.2468 vs 0.2476.","timestamp":1773643455454,"segment":0}
{"run":28,"commit":"ad6d9e3","metric":0.25325963907889737,"metrics":{},"status":"keep","description":"perf(webrtc): add a receive-path fast path that decodes complete single-message frames directly instead of always feeding the streaming length-prefix decoder; rerun confirms a real win, improving ratio from 0.2476 to 0.2533 with faster download throughput.","timestamp":1773643576777,"segment":0}
{"run":29,"commit":"7d5ef00","metric":0.25381034135241787,"metrics":{},"status":"keep","description":"perf(webrtc): make RTCDataChannel.onmessage synchronous after adding the direct single-frame receive fast path; ratio improved slightly from 0.2533 to 0.2538.","timestamp":1773643692265,"segment":0}
{"run":30,"commit":"7d5ef00","metric":0.24837361245175532,"metrics":{},"status":"discard","description":"perf(webrtc): add a protobuf receive fast path for the common message-only shape to bypass Message.decode after the direct single-frame fast path; ratio regressed from 0.2538 to 0.2484.","timestamp":1773643817047,"segment":0}
{"run":31,"commit":"7d5ef00","metric":0.24308826866864747,"metrics":{},"status":"discard","description":"perf(webrtc): re-test MAX_BUFFERED_AMOUNT at 8 MiB on top of the current receive fast path + synchronous onmessage + 75% resume configuration; ratio still regressed from 0.2538 to 0.2431.","timestamp":1773643945701,"segment":0}
{"run":32,"commit":"7d5ef00","metric":0.24162918940921482,"metrics":{},"status":"discard","description":"bench: rerun the unchanged current best configuration to gauge remaining variance; ratio came in at 0.2416 versus the kept 0.2538, so even the anchored direct-only benchmark still has meaningful residual noise.","timestamp":1773644068211,"segment":0}
{"type":"config","name":"Improve pure WebRTC browser-streaming proxy throughput against anchored TCP baseline with 3-iteration direct benchmark","metricName":"webrtc_direct_tcp_ratio","metricUnit":"","bestDirection":"higher"}
{"run":1,"commit":"7d5ef00","metric":0,"metrics":{},"status":"crash","description":"Baseline for the reinitialized 3-iteration direct benchmark crashed with DataChannel is closed during continued send-on-drain, suggesting the current best transport tuning has an intermittent close/drain race that the longer workload exposes.","timestamp":1773644224493,"segment":0}
{"run":2,"commit":"7d5ef00","metric":0.24647309982651214,"metrics":{},"status":"discard","description":"perf(utils): guard continueSendingOnDrain so it does not resume sending after the stream has closed, and build packages/utils in the harness; this may reduce a rare close/drain race but ratio fell from the current 3-iteration best of 0.2538 to 0.2465.","timestamp":1773644453154,"segment":0}
{"run":3,"commit":"804d378","metric":0.2551117840811252,"metrics":{},"status":"keep","description":"perf(webrtc): under the reinitialized 3-iteration direct benchmark, increase node SCTP send buffer from 8 MiB to 9 MiB while keeping recv at 4 MiB plus the receive fast-path wins; ratio improved from 0.2538 to 0.2551, mostly via faster upload throughput.","timestamp":1773644672745,"segment":0}
{"run":4,"commit":"804d378","metric":0.2515112247024432,"metrics":{},"status":"discard","description":"perf(webrtc): push node SCTP send buffer from 9 MiB to 10 MiB under the 3-iteration benchmark; ratio regressed from 0.2551 to 0.2515, so 9 MiB remains the better send-buffer setting.","timestamp":1773644827150,"segment":0}
{"run":5,"commit":"804d378","metric":0.15636362975752524,"metrics":{},"status":"discard","description":"perf(webrtc): start probing lower-level libdatachannel tuning by setting maxChunksOnQueue=2048 alongside the 9 MiB/4 MiB SCTP buffers; throughput collapsed and ratio fell from 0.2551 to 0.1564.","timestamp":1773645059658,"segment":0}
{"run":6,"commit":"804d378","metric":0.20407782230696794,"metrics":{},"status":"discard","description":"perf(webrtc): probe lower-level libdatachannel SCTP tuning by setting delayedSackTime=0 alongside the current 9 MiB/4 MiB buffers; throughput regressed badly and ratio fell from 0.2551 to 0.2041.","timestamp":1773645321712,"segment":0}
{"run":7,"commit":"804d378","metric":0,"metrics":{},"status":"crash","description":"perf(webrtc): probe lower-level libdatachannel SCTP tuning with initialCongestionWindow=32 on top of the current 9 MiB/4 MiB buffers; connection setup became unstable and crashed with UnexpectedEOF during stream negotiation.","timestamp":1773645452406,"segment":0}
{"run":8,"commit":"804d378","metric":0.2465138175988864,"metrics":{},"status":"discard","description":"perf(webrtc): probe lower-level libdatachannel SCTP tuning with initialCongestionWindow=16 alongside the 9 MiB/4 MiB buffers; connection stability returned but ratio still regressed from 0.2551 to 0.2465.","timestamp":1773645653206,"segment":0}
{"run":9,"commit":"804d378","metric":0.25168074729074663,"metrics":{},"status":"discard","description":"perf(webrtc): raise node SCTP recv buffer from 4 MiB to 5 MiB alongside the 9 MiB send buffer and current receive-path wins; throughput stayed strong but ratio still trailed the 4 MiB recv best at 0.2517 vs 0.2551.","timestamp":1773645818643,"segment":0}
{"run":10,"commit":"804d378","metric":0.246623175117419,"metrics":{},"status":"discard","description":"perf(webrtc): probe lower-level libdatachannel SCTP tuning with delayedSackTime=20ms alongside the current 9 MiB/4 MiB buffers; ratio regressed from 0.2551 to 0.2466.","timestamp":1773645982598,"segment":0}
{"run":11,"commit":"804d378","metric":0,"metrics":{},"status":"crash","description":"perf(webrtc): probe lower-level libdatachannel SCTP tuning with initialCongestionWindow=8 alongside the 9 MiB/4 MiB buffers; benchmark timed out, so this setting is at least unstable on the current workload.","timestamp":1773646113445,"segment":0}
{"run":12,"commit":"804d378","metric":0.23305152963559359,"metrics":{},"status":"discard","description":"perf(webrtc): probe underlying libdatachannel/libjuice path by forcing node-datachannel PeerConnection mtu=1200 for WebRTC-direct; ratio regressed sharply from 0.2551 to 0.2331.","timestamp":1773646284867,"segment":0}
{"run":13,"commit":"ef81296","metric":0.2909061221190393,"metrics":{},"status":"keep","description":"perf(webrtc): probe the underlying libdatachannel/libjuice path by forcing node-datachannel PeerConnection mtu=1500 for WebRTC-direct; ratio jumped from 0.2551 to 0.2909 with much faster upload and download throughput.","timestamp":1773646453549,"segment":0}
